Movie,Scene,Character,Dialogue
AMERICAN_PSYCHO,INT. BATEMAN'S OFFICE - MORNING,BATEMAN,"oh that? just mulling over business problems. examining opportunities...exchanging rumors...spreading gossip. they laugh politely. hi. i'm donald kimball. hi. pat bateman. nice to meet you. i'm sorry to barge in on you like this, but i was supposed to talk to luis carruthers and he wasn't in and...well, you're here, so... i know how busy you guys can get. kimball stares at the three open copies of sports illustrated and the sony walkman lying on bateman's desk. bateman sees the look and sweeps the magazines into the top drawer along with the walkman, which is still running. so, what's the topic of discussion? i've been hired by meredith powell to investigate the disappearance of paul owen. you're not with the fbi or anything, are i you? nothing like that. i'm just a private investigator. ah, i. see...yes. paul's disappearance....yes."
AMERICAN_PSYCHO,INT. BATEMAN'S OFFICE - MORNING,KIMBALL,so it's nothing that official. i just have some basic questions. about paul owen. about yourself coffee?
AMERICAN_PSYCHO,INT. BATEMAN'S OFFICE - MORNING,KIMBALL,"no, i'm okay. perrier? san pellegrino? no, i'm okay. kimball takes out a small black notepad and the same gold cross pen that bateman and his friends all use. bateman buzzes jean. patrick?"
AMERICAN_PSYCHO,INT. BATEMAN'S OFFICE - MORNING,BATEMAN,can you bring mr.... kimball.
AMERICAN_PSYCHO,INT. BATEMAN'S OFFICE - MORNING,KIMBALL,"mr.kimball a bottle of san pelle oh no, i'm okay. it's no problem. bateman watches intently as kimball writes something down in his notebook, then crosses something out. jean enters and places the bottle of san pellegrino and a steuben etched glass on the table, shooting a concerned glance at bateman. he glares at her. kimball smiles and nods at jean as she leaves. well, what's the topic of discussion? the disappearance of paul owen."
AMERICAN_PSYCHO,INT. BATEMAN'S OFFICE - MORNING,KIMBALL,"oh right. well, i haven't heard anything about the disappearance or anything not on page six at least. i think his family want this kept quiet. understandable. lime? no, really. im okay. you sure? i can always get you a lime. a pause. just some preliminary questions that i need for my own files, okay? shoot."
AMERICAN_PSYCHO,INT. BATEMAN'S OFFICE - MORNING,BATEMAN,how old are you? twenty seven. i'll be twenty eight in october. where did you go to school? harvard. the harvard business school. your address?
AMERICAN_PSYCHO,INT. BATEMAN'S OFFICE - MORNING,KIMBALL,"nice. very nice. thanks. a pause as kimball studies' his notebook. bateman closes his eyes shut, as if in pain. pardon me, but are you okay? why do you ask? you seem...nervous. bateman reaches into his desk drawer and brings out a bottle of aspirin. nuprin?"
AMERICAN_PSYCHO,INT. BATEMAN'S OFFICE - MORNING,BATEMAN,"uh...no, thanks. kimball takes out a pack of marlborough and lays it on the desk. bad habit. i know. i'm sorry. a pause, as bateman stares at the cigarettes. would you rather i not smoke? no, i guess it's okay. you sure?"
AMERICAN_PSYCHO,INT. BATEMAN'S OFFICE - MORNING,KIMBALL,"no problem. yes, patrick? bring us an ashtray for mr. kimball, please. she whisks in with a crystal ashtray as they sit in silence. what can you tell me about paul owen? well..."
AMERICAN_PSYCHO,INT. BATEMAN'S OFFICE - MORNING,BATEMAN,"how well did you know him? i'm... at a loss. he was part of that whole...yale thing, you know. yale thing? a pause. yeah...yale thing. what do you mean ... yale thing? a pause. well, i think for one that he was probably a closet homosexual. who did a lot of cocaine... that yale thing. a silence during which the sound of the air conditioner becomes deafening."
AMERICAN_PSYCHO,INT. BATEMAN'S OFFICE - MORNING,KIMBALL,"so...there's nothing you can tell me about paul owen? he led what i suppose was an orderly life. he ... ate a balanced diet. what kind of man was he? besides ... the information you've just given. i hope i'm not being crossexamined here. do you feel that way? no. not really. where did paul hang out? hang...out? yeah. you know ... hang out. let me think. the newport. harry's. fluties. indochine. nell's. cornell club. the new york yacht club. the regular places. he had a yacht? no, he just hung out there. and where did he go to school? a slight pause."
AMERICAN_PSYCHO,INT. BATEMAN'S OFFICE - MORNING,KIMBALL,"don't you know this? i just wanted to know if you know. before yale? if i remember correctly, saint paul's....listen, i just .... i just want to help. i understand. he makes another note. anything else you can tell me about owen? we were both seven in 1969. so was i. do you have any witnesses or f ingerprints? well, there's a message on his answering machine saying he went to london. well, maybe he did, huh? his girlfriend doesnt think so. but ... has anyone seen him in london? actually, yes. hmm."
AMERICAN_PSYCHO,INT. BATEMAN'S OFFICE - MORNING,KIMBALL,"was he involved at all, do you think, in occultism or satan worship? what?"
AMERICAN_PSYCHO,INT. BATEMAN'S OFFICE - MORNING,BATEMAN,"i know it sounds like a lame question, but in new jersey last month i don't know if you've heard about this, but a young stockbroker was recently arrested and charged with murdering a young chicano girl and performing voodoo rituals with various body parts yikes! no. paul wasn't into that. he followed a balanced diet and yeah, i know, and was into that whole yale thing. a pause the longest so far. have you consulted a psychic? no."
AMERICAN_PSYCHO,INT. BATEMAN'S OFFICE - MORNING,KIMBALL,"had his apartment been burglarized? no, it actually hadn't. toiletries were missing. a suit was gone. so was some luggage. that's it."
AMERICAN_PSYCHO,INT. BATEMAN'S OFFICE - MORNING,KIMBALL,"i mean noone's dealing with the homicide squad yet or anything, right? no, not yet. as i said, we're not sure. but... basically no one has seen or heard anything. that's so typical, isn't it? it's just strange. one day someone's walking around, going to work, alive, and then... nothing."
AMERICAN_PSYCHO,INT. BATEMAN'S OFFICE - MORNING,KIMBALL,"people just... disappear. the earth just opens up and swallows people. eerie. really eerie. silence. you'll have to excuse me. i have a lunch meeting with cliff huxtable at four seasons in twenty minutes. isn't the four seasons a little far uptown? i mean aren't you going to be late? uh, no. there's one... down here. oh really? i didn't know that."
AMERICAN_PSYCHO,INT. BATEMAN'S OFFICE - MORNING,KIMBALL,"yes. it's very good. kimball turns to face him. listen, if anything occurs, to you, any information at all... absolutely, i'm 100 with you. great, and thanks for your uh, time, mr. bateman. bateman closes the door firmly on kimball. he closes his eyes and leans against the door, sweating."
AMERICAN_PSYCHO,INT. COURTNEY'S APT - NIGHT,COURTNEY,will you call me before thanksgiving? maybe.
AMERICAN_PSYCHO,INT. COURTNEY'S APT - NIGHT,BATEMAN,"what are you doing tonight? dinner at the river cafe. au bar afterwards, maybe. that's nice."
AMERICAN_PSYCHO,INT. COURTNEY'S APT - NIGHT,BATEMAN,"we were supposed to have dinner at tad and maura's, but you know how luis is... i never knew you smoked. you never noticed. bateman is making final adjustments to his tie. listen...patrick. can we talk? you look marvelous.. there's nothing to say. you're going to marry luis. next week, no less. isn't that special? patrick? yes, courtney? if i don't see you before thanksgiving, have a nice one, okay? you too. courtney picks up the black cat and starts petting its head. bateman heads down the hallway to the front door. patrick? yes?"
AMERICAN_PSYCHO,INT. VIDEO STORE - SAME NIGHT,CASHIER,"i'm wandering around video visions drinking a diet pepsi and listening to the new christopher cross tape on my sony walkman. he stops by 'comedy' and picks up a woody allen movie, then moves on to 'horror'. suddenly im seized by a minor anxiety attack. there are too many fucking movies to choose from. he surreptitiously pops several pills into his mouth. bateman waiting at the counter, impatient because he's not first in line. he is holding three films, one of which is body double. when he approaches the counter, the cashier rolls her eyes and gives a knowing glance to one of her co workers. there is a silence as she rings up the tapes. i like the part where the woman gets drilled by the ... power driller in the movie ...the best. and the blood starts pouring from the ceiling. sign here. uh... you've rented this movie... this'll be 37 times. bateman signs and snatches the tape off the counter and walks away."
AMERICAN_PSYCHO,INT. NIGHTCLUB - NIGHT,KIMBALL,mr. bateman? bateman gasps and recovers. detective kendall...uh campbell? kimball. call me don. don.
AMERICAN_PSYCHO,INT. NIGHTCLUB - NIGHT,KIMBALL,"so... you hang out here a lot? uh, yes... i mean... whenever necessary. you know. pause. how's the investigation going? taken anyone in for ""formal questioning""? oh no. informal conversations, mostly. what's that, stoli? yeah. no finlandia, as usual. fucking dump."
AMERICAN_PSYCHO,INT. NIGHTCLUB - NIGHT,MCDERMOTT,"some people just can't help themselves. another stoli? bateman shakes his head. i mean they want to get caught. dan, great to see you again. like i said, you need anything at all, i'm your man. i don't envy your job. i mean owen was a... complex man. bateman wanders away. he looks back uneasily at kimball who is watching him from the bar. a guy with dreadlocks walks by. rasta man! the man stares at him. i mean mon. we be jammin' ... the man walks by, shaking his head. bateman wanders into the next room, which is filled, with, a more familiar crowd young men in designer suits, girls in black designer dresses. across the room he spots mcdermott, and price sitting with three models, all wearing black mini dresses. price and mcdermott are having a whispered argument. i have to talk to these girls? they're models.."
AMERICAN_PSYCHO,INT. NIGHTCLUB - NIGHT,BATEMAN,"lets have a conversation. so... it was hot out today, no? silence. where did craig go? well gorbachev is downstairs. mcdermott is' going to sign a peace treaty with him between the united states and russia. mcdermott's the one behind glasnost, you know. well... yeah. but he told me he was in mergers and acquisitions. you're not confused, are you? no, not really. gorbachev's not downstairs. are you lying? yes, caron's right. gorbachev's not downstairs. hes at tunnel. ask me a question."
AMERICAN_PSYCHO,INT. NIGHTCLUB - NIGHT,BATEMAN,"so, what do you do? what do you think i do? a model? an actor? no. flattering, but no. well..."
AMERICAN_PSYCHO,INT. NIGHTCLUB - NIGHT,BATEMAN,"i'm into, well, murders and executions mostly. do you like it? well... it depends, why? well most guys i know who work in mergers and acquisitions don't really like it. silence. so, where do you work out? the club is halfempty now. price is leaning over a balcony, messed up on drugs. bateman comes up behind him in a menacing way that suggests he might push him over the railing. price turns around, wildeyed, just as bateman is reaching for him. i'm leaving. i'm getting out. leaving what? this."
AMERICAN_PSYCHO,INT. NIGHTCLUB - NIGHT,BATEMAN,"don't, i'll drink it. listen to me, patrick. i'm leaving. where to? are you going to go get a gram? i'm leaving! i...am...leaving! don't tell me... merchant banking? no you dumb son of a bitch. i'm serious. i'm disappearing. where to? morgan stanley? rehab? what? price looks away. mcdermott and daisy walk up to them. hey don't worry, be happy. price lifts his arms up as if greeting the crowd and is shouting something that can't be heard, then goodbye! fuckheads! he climbs over the railing. what is he doing? price! come back! price leaps from the balcony. he disappears for a moment then resurfaces and runs off into the crowd."
AMERICAN_PSYCHO,EXT. CLUB - NIGHT,DAISY,"my exboyfriend, fiddler, who was in there, he plays in this band that just opened for u2 he couldn't understand what i was doing with a yuppie. oh really? he said... he said you gave him bad vibes. that's... that's too bad. you think i'm dumb, don't you? what?"
AMERICAN_PSYCHO,EXT. CLUB - NIGHT,DAISY,you think i'm dumb. you think all models are dumb. no. i really don't. that's ok. i don't mind. there's something sweet about you. she takes his hand as they get into a cab
AMERICAN_PSYCHO,INT. BATEMAN'S OFFICE - LATE AFTERNOON,JEAN,doin' the crossword? bateman nods without looking up. need help? bateman doesn't respond. we see that every space on the puzzle has been filled in with the words meat or bone. jean drops the folder on his desk and then walks out. jean?
AMERICAN_PSYCHO,INT. BATEMAN'S OFFICE - LATE AFTERNOON,JEAN,"yes, patrick? would you like to accompany me to dinner. he erases one of the m's on the crossword puzzle. that is... if you're not doing anything. oh no. i have no plans. well, isn't this a coincidence. a pause. listen, where should we go? he leans back and pulls a zagat's from the desk drawer. anywhere you want?"
AMERICAN_PSYCHO,INT. BATEMAN'S OFFICE - LATE AFTERNOON,MAITRE D,"let's not think about what i want. how about anywhere you want. oh patrick, i can't make this decision. no, come on. anywhere you want. oh, i can't, i don't know. come on. where do you want to go? anywhere you want. just say it. i can get us in anywhere. a long pause. what about... dorsia? bateman stops looking through the zagat guide and smiles at her. soooo... dorsia is where jean wants to go.... oh, i don't know. no, we'll go anywhere you want. dorsia is... fine. he dials the number. dorsia, yes? yes, can you take two tonight, oh, let's say, at nine o'clock? he checks his rolex and winks at jean. we are totally booked."
AMERICAN_PSYCHO,INT. BATEMAN'S OFFICE - LATE AFTERNOON,BATEMAN,"oh really? thats great. i said we are totally booked. two at nine? perfect. there are no tables available tonight. the waiting list is also totally booked. see you then. he hangs up the phone. he walks over to the coat rack. he glances over at jean who is still standing in front of the desk, confused. yes? you're dressed...okay. you didnt give them a name. they know me. pause. why don't you meet me at my house at 700 for drinks, ok? she turns to leave. and jean? you'll want to change before we go out."
AMERICAN_PSYCHO,INT. BATEMAN’S APARTMENT - EARLY EVENING,JEAN,patrick it's so...elegant. what a wonderful view. bateman opens up the freezer where daisy's head.is clearly visible.
AMERICAN_PSYCHO,INT. BATEMAN’S APARTMENT - EARLY EVENING,JEAN,"jean? sorbet? thanks, patrick. i'd love some. bateman walks in with a bottle of wine and a corkscrew in his hand and hands her the sorbet. jean is eating the sorbet. want a bite? i'm on a diet. but thank you. you. don't need to lose any weight. you're kidding, right? you look great. very fit. you can always be thinner. look... better. well, maybe we shouldn't go out to dinner. i don't want to ruin your ,willpower. no. it's all right. i'm not very good at controlling it anyway. silence, as bateman walks around his apartment, opens up his knife drawer, looking at the knives. so listen, what do you really want to do with your life? pause. and don't tell me you enjoy working with children, okay?"
AMERICAN_PSYCHO,INT. BATEMAN’S APARTMENT - EARLY EVENING,JEAN,"do you have a boyfriend? no, not really. interesting. are you seeing anyone? i mean, seriously? maybe. i don't know. not really. bateman opens up a cupboard where there are a lot of very neatly ordered weapons an ax, a rifle, a chain saw, duct tape, twine and a nail gun. jean, do you feel... fulfilled? i mean, in your life? well, i guess i do. for a long time i was too focused on my work, i think, but now i've really begun to think about changing myself, you know, developing, and...growing. growing. i'm glad you said that. bateman picks up the duct tape. did you know that ted bundy's first dog, a collie, was named lassie? had you heard this?"
AMERICAN_PSYCHO,INT. BATEMAN’S APARTMENT - EARLY EVENING,BATEMAN,"forget it. whats that? oh. uh, tape. duct tape. i...need it for...taping something. bateman goes back to the cupboard for the nail gun. patrick, have you ever wanted to make someone happy? jean puts her spoon down on the table. what... no! put it in the carton. sorry. jean? what? make someone happy have you ever wanted to? from behind we follow bateman as he walks across the room and stands behind the couch. i'm looking for... i guess you could say i just want to have a meaningful relationship with someone special. hmmmm..."
AMERICAN_PSYCHO,INT. BATEMAN’S APARTMENT - EARLY EVENING,BATEMAN,"patrick. i know you're there. pick up the phone you bad boy. what are you up to tonight? it's me. don't try to hide. i hope you're not out with some little number you picked up because you're my mr. bateman. my boy next door. anyway you never called me and you said you would and i'll leave a message for jean about this too to remind you but we're having dinner with melania and taylor you know melania, she went to sweet briar, and taylor, he went to cornell and we're meeting at the cornell club, so ill call you tomorrow morning probably bye honey ooops! you hate that. by mr.big time ceo patrick. bye. bye. silence. jean is obviously embarrassed and upset. was that ... evelyn? silence. are you still seeing her? silence i'm sorry, i have no right to ask that. silence. do you want me to go? a long pause."
AMERICAN_PSYCHO,INT. BATEMAN’S APARTMENT - EARLY EVENING,BATEMAN,"i know i should go. i know i have a tendency to get involved with unavailable men, and... i mean, do you want me to go? another long pause. if you stay, i think something bad will happen. i think i might hurt you. you don't want to get hurt, do you? no. no, i guess not. i don't want to get bruised. you're right, i should go. she gets up to leave. and don't forget you have a breakfast meeting with frederick bennet and charles rust at '21. thanks. it slipped my mind completely. he sinks back on the sofa and shuts his eyes."
AMERICAN_PSYCHO,INT. BATEMAN'S OFFICE - DAY,BATEMAN,"kimball i've been wanting to talk with you! come into my office. jean, great jacket. matsuda? jean looks flustered. kimball follows bateman into his office."
AMERICAN_PSYCHO,INT. BATEMAN'S OFFICE - DAY,KIMBALL,"i actually came to see timothy price, but he's taken a leave, of absence. yeah, gone into rehab. shame, is he a suspect? not really. a pause. do you remember where you were on the night of paul's disappearance? which was on the twentieth of december? god... i guess... i was probably returning videotapes. he opens his desk drawer and pretends to search through his diary. i had a date with a girl named veronica. wait. thats not what i've got. what?"
AMERICAN_PSYCHO,INT. BATEMAN'S OFFICE - DAY,KIMBALL,that's not the information i've received. well...i...wait...what information have you received? lets see... that you were with
AMERICAN_PSYCHO,INT. BATEMAN'S OFFICE - DAY,BATEMAN,"well, i could be wrong. well ....when was the last time you were with paul owen? we had .... gone to a new musical called ... 'oh africa, brave africa'. it was ... a laugh riot... and that's about it. i think we had dinner at orso's. no petaluma. no, orso's. the .... last time i physically saw him was .... at an automated teller. i can't remember which ...just one that was near, urn, nell's. kimball is clearly giving up on bateman for now. he opens his briefcase, to put away his notebook. well, thank you, mr. bateman. patrick, please. i hope i've been informative. long day a bit scattered. listen, i'm a little spent for now but how about lunch in a week or so when ive sorted out all this information? great, yes, i'd like that. and if you could try and pin down where you were the night of owen's disappearance, it would make my job a lot easier. absolutely. i'm with you on that one. kimball is rifling through his brief case. he pulls out a new shrinkwrapped cd and holds it up."
AMERICAN_PSYCHO,INT. BATEMAN'S OFFICE - DAY,BATEMAN,"huey lewis and the news. great stuff. heard it? i just bought it on my way here. bateman stares at the cd stunned, terrified. never. i mean... i don't really like... singers. not a big music fan, eh? no, i like music. just they're huey's too... black sounding. for me. well, to each his own. so lunch, thursday? i'll call your secretary about reservations. i'll be there."
AMERICAN_PSYCHO,EXT. MEAT PACKING DISTRICT/INT/ LIMOUSINE - NIGHT,BATEMAN,"im not so sure about this. i had to go to emergency after last time... oh this won't be anything like last time, i promise. i don't think so. he hands her five hundred dollars. just come in the limo and talk to me for a minute. the driver's here, you'll be safe."
AMERICAN_PSYCHO,EXT. MEAT PACKING DISTRICT/INT/ LIMOUSINE - NIGHT,BATEMAN,"nothing like last time, promise. alright."
AMERICAN_PSYCHO,EXT. MEAT PACKING DISTRICT/INT/ LIMOUSINE - NIGHT,BATEMAN,"so, you're looking great, how have you been? well, i actually might need a little surgery after last time. really? my friend told me i should maybe even get a lawyer. oh, lawyers are so complicated don't do that. here. he writes her a check for 1,000 to cash and hands it to her. she snatches the check out of his hand and gets quickly out of the limo, walking hurriedly down the street. bitch."
AMERICAN_PSYCHO,EXT. MEAT PACKING DISTRICT/INT/ LIMOUSINE - NIGHT,BATEMAN,"uh uh uh. half now, half later. she takes the money and puts it inside her shirt."
AMERICAN_PSYCHO,EXT. MEAT PACKING DISTRICT/INT/ LIMOUSINE - NIGHT,BATEMAN,"okay, your name is christie. we're meeting a friend of mine, elizabeth. she'll be joining us in my new apartment shortly. you'll like her. she's a very nice girl. dont say anything about yourself. is that clear, christie? christie nods."
AMERICAN_PSYCHO,INT. PAUL OWEN'S APARTMENT - NIGHT,ELIZABETH,"you look really familiar? did you go to dalton? christie.shakes her head. the kitchen bateman is grinding up tabs of ecstasy and putting them in a bottle of wine. in the living room elizabeth is still staring at christie as if she comes from mars. i think i met you at au bar, didnt i? with spicey? christie looks blank. well, maybe not with spicey but it was definitely at au bar. christie still blank. you know, au bar? christie shakes her head."
AMERICAN_PSYCHO,INT. PAUL OWEN'S APARTMENT - NIGHT,ELIZABETH,"this is nicer than your other apartment. it's not that nice. silence. where did you two meet? oh god! i met him at, oh god, the kentucky derby in '86 no, '87, and... you were hanging out with that bimbo allison poole. hot number. what do you mean, she was a hot number. if you had an american express card she'd give you a blow job. listen, this girl worked in a tanning salon, need i say more?.... what do you do? a long silence. christie reddens and stares at the floor. she's my... cousin."
AMERICAN_PSYCHO,INT. PAUL OWEN'S APARTMENT - NIGHT,ELIZABETH,"she's from ... france. a pause. elizabeth looks at bateman dubiously. where's your phone? i've got to call harley. bateman hands her a cordless phone. she dials, and stares at christie while she waits for someone to answer. where do you summer? southampton? christie looks at bateman and then back at elizabeth. no."
AMERICAN_PSYCHO,INT. PAUL OWEN'S APARTMENT - NIGHT,ELIZABETH,"oh god, it's his machine. elizabeth, it's three in the morning. he's a goddamn drug dealer! these are his peak hours. don't tell him you're here. why would i? bateman has poured her another glass of wine. she downs the whole glass, making a face. this tastes weird. harley? it's me. i need your services. translate that anyway you'd like. i'm at bateman"
AMERICAN_PSYCHO,INT. PAUL OWEN'S APARTMENT - NIGHT,ELIZABETH,"paul owen. i want the number, idiot. anyway, i'm at paul norman's and i'll try you later and if i don't see you at canal bar tomorrow night i'm going to sick my hairdresser on you. she hangs up. did you know that guy who disappeared? didn't he workat pierce pierce too? was he a friend of yours? no."
AMERICAN_PSYCHO,INT. PAUL OWEN'S APARTMENT - NIGHT,BATEMAN,"do you have any coke? or halcyon? i'd take a halcyon. bateman sits next to elizabeth on the couch and pours her another glass of the drugged wine. listen, i would just like to see... the two of you... get it on. what's wrong with that? it's totally diseasefree. patrick, you're a lunatic. come on. don't you find christie attractive?"
AMERICAN_PSYCHO,INT. PAUL OWEN'S APARTMENT - NIGHT,BATEMAN,"let's not get lewd. i'm in no mood to have a lewd conversation. come on. i think it would be a turnon. does he do this all the time? christie shrugs. christie, you're not drinking your wine. christie looks at her wine and gingerly takes a sip. are you telling me you've never gotten it on with a girl? no! i'm not a lesbian. why do you think i'd be into that? well, you went to sarah lawrence for one thing. those are sarah lawrence guys, patrick. you're making me feel weird. elizabeth is. now writhing around on the couch and making out with christie. bateman holds up a whitney houston cd, showing them the picture of whitney on the cover."
