Movie,Scene,Character,Dialogue
AMERICAN_PSYCHO,INT. PAUL OWEN'S APARTMENT - NIGHT,BATEMAN,"you actually listen to whitney houston? you actually have a whitney houston cd? more than one? she giggles, rolling off the sofa onto the floor. its hard to choose a favorite track among so many great ones, but 'the greatest love of all is one of the best, most powerful songs ever written about selfpreservation and dignity. it's universal message crosses alll boundaries, and instills one with the hope that it's not too late to better ourselves, to act kinder. since, elizabeth, it's impossible in the world we live in to empathize with others, we can always empathize with ourselves. as he speaks, he opens the case and carefully places the cd in the player, admiring its pristine silver surface, and watches it slide into the machine. it's an important message, crucial, really, and it's beautifully stated on the album."
AMERICAN_PSYCHO,INT. BEDROOM - LATER,BATEMAN,"not the face, you bitch. not the fucking face you piece of bitch trash. christie, screaming, makes it out the front door. bateman runs after her. she runs down the hall screaming and banging on doors. she moves.to the elevator, pounding hysterically on the buttons. she sees the stairwell and runs for it. bateman sees this and runs after her, revving the chainsaw. she runs down the stairs, bateman two flights behind her. he stops, leans over the railing to look at her, then aims the chainsaw at her and drops it. christie screams off screen, then is suddenly silent. from bateman's pov. we see christies body sprawled face down at the bottom of the stairwell. the chainsaw sticks out of her back like a sword."
AMERICAN_PSYCHO,INT. CRAYONS - EARLY EVENING,BATEMAN,i want a firm commitment.
AMERICAN_PSYCHO,INT. CRAYONS - EARLY EVENING,BATEMAN,"why? what's wrong? my need to engage in homicidal behaviour on a massive scale cannot be, urn, corrected...but i have no other way to fulfill my ... needs. the woman across the room holds up her hand, displaying a new bracelet. evelyn smiles and nods approvingly. we need to talk. talk about what, patrick? what is there to talk about? it's over, evelyn. it's all over. touchy, touchy. i'm fucking serious. it's fucking over. us. this is no joke. i don't think we should see each other any more. but your friends are my friends. my friends are your friends. i don't think it would work. you have a little something on your upper lip."
AMERICAN_PSYCHO,INT. CRAYONS - EARLY EVENING,EVELYN,"you're really serious, aren't you? yes, i am. do you have something against me, patrick? evelyn, i'm sorry. you're just not... terribly important to me. well, who is, patrick? who do you think is? what do youwant? i want it to be over. but what about our past? we never really shared one. you're inhuman. im ...in touch with humanity. no, no, no. i know my behaviour is ... erratic sometimes. she reaches desperately across the table, takes his hand and pulls it to her. bateman pulls his hand away."
AMERICAN_PSYCHO,INT. CRAYONS - EARLY EVENING,EVELYN,if you really want to do something for me you can stop making this scene right now. you're so lousy. you are not... not what?
AMERICAN_PSYCHO,INT. CRAYONS - EARLY EVENING,BATEMAN,"you are not all there. you don't add up. i do too. i do too add up. oh god, i can't believe this. i'm leaving now. i've assessed the situation and i'm going. where are you going? i'm just leaving. but where? i have to return some video tapes. he rushes out of the room."
AMERICAN_PSYCHO,EXT. TRIBECA STREET - EVENING,COP CAR,"here kitty, kitty. the small mangy cat rubs against him, he picks it up and walks toward an atm holding the cat. he puts his card in the machine. the screen reads feed me a stray cat. bateman begins to attempt to shove the kitten into the deposit slot with some difficulty. the kitten squeals. he takes a gun from out of his pocket and points it at the kitten. he doesn't notice the woman waiting behind him. oh my god! stop that! what are you doing? bateman wheels around and shoots her. she falls screaming to the floor. responding to the gunshot, a police car siren wails in the distance. bateman breaksinto a run. the police car screeches after him. halt. stop. put down your weapon. bateman ducks down an alley."
AMERICAN_PSYCHO,EXT. STREET - NIGHT,COP CAR,halt. put down your weapon.
AMERICAN_PSYCHO,INT. OFFICE BUILDING - NIGHT,NIGHT WATCHMAN,"burning the midnight oil, mr. smith? you forgot to sign in. bateman wheels around and shoots him. he runs toward the revolving doors. as he swings round in the doors he notices a janitor who has witnessed the shooting. he revolves back into the lobby and shoots the janitor. new angle he runs out of the building and across the street to pierce and pierce."
AMERICAN_PSYCHO,INT. BATEMAN'S OFFICE - NIGHT,BATEMAN,"harold, it's bateman. patrick bateman. you're my lawyer so i think you should know i've killed a lot of people. some escort girls, in an apartment uptown, some homeless people, maybe five or ten, an nyu girl i met in central park. i left her in a parking lot, near dunkin' donuts. i killed bethany, my old girlfriend, with a nail gun, and a man, some old faggot with a dog. last week i killed another girl with a chainsaw i had to, she almost got away. there was someone else there, maybe a model, i can't remember but she's dead too. and paul owen. i killed paul owen with an ax, in the face. his body is dissolving in a bathtub in hell's kitchen. i don't want to leave anything out here... i guess i've killed 20 people, maybe 40 i have tapes of a lot of it. some of the girls have seen the tapes, i even... well i ate some of their brains and i tried to cook a little. tonight i just, well i had to kill a lot of people and i'm not sure i'm going to get away with it this time i mean i guess i'm a pretty sick guy. so if you get back tomorrow, i may show up at harry's bar so, you know, keep your eyes open. bateman hangs up the phone. the helicopter search light circles back, briefly illuminating the room. the camera rises up over bateman huddled in the corner, staring blankly at the sky."
AMERICAN_PSYCHO,INT. SMITH AND WOLLENSKY RESTAURANT - DAY,KIMBALL,"no hash browns? not in the mood, i guess. but... everyone orders the hash browns here. i mean it's have you been here before? yes, of course. the hash browns are delicious.. i'm just... not... ordering them. suit yourself, i guess. pause. so, the night he disappeared? any new thoughts on what you did? i'm not really sure. i had a shower...and some sorbet? i think maybe you've got your dates mixed up. but how? where do you place paul that night? according to his date book, and this was verified by his secretary, he had dinner with ... marcus halberstam. and?"
AMERICAN_PSYCHO,INT. SMITH AND WOLLENSKY RESTAURANT - DAY,KIMBALL,i've questioned him. marcus?
AMERICAN_PSYCHO,INT. SMITH AND WOLLENSKY RESTAURANT - DAY,BATEMAN,yes. and he denies it. though at first he couldn't be sure. but marcus denied it? yes.
AMERICAN_PSYCHO,INT. SMITH AND WOLLENSKY RESTAURANT - DAY,BATEMAN,"well,.does marcus have an alibi? yes."
AMERICAN_PSYCHO,INT. SMITH AND WOLLENSKY RESTAURANT - DAY,KIMBALL,he does? you're sure? i checked it out. it's clean. oh.
AMERICAN_PSYCHO,INT. SMITH AND WOLLENSKY RESTAURANT - DAY,KIMBALL,"now where were you? where was marcus? he wasn't with paul owen. so who was he with? he was at atlantis with craig mcdermott, frederick dibble, harry newman, george butner and"
AMERICAN_PSYCHO,INT. SMITH AND WOLLENSKY RESTAURANT - DAY,MCDERMOTT,"oh, right. of course.... we had wanted paul owen to come. but he said he had plans... i guess i had dinner with victoria... the following night. personally i think the guy went a little nutso. split town for a while. maybe he did go to london. sightseeing. drinking. whatever. anyway, i'm pretty sure he'll turn up sooner or later. i mean to think that one of his friends killed him, for no reason whatsoever would be too ridiculous. isn't that right, patrick? mcdermott stops by the table. kimball! how's the investigation? talking to bateman? don't believe a word he says. bateman, what's wrong with you? bateman looks at him in silence, panicking. you can't eat at smith and wollensky without ordering the hash browns. jesus bateman, you're a raving maniac. been at pierce pierce too long. no fucking hash browns..."
AMERICAN_PSYCHO,INT. PAUL OWEN'S APARTMENT BUILDING - DAY,MRS WOLFE,"what can i do for you, sir? of course. mrs. wolfe is up thereright now. mrs.... wolfe? the real estate agent? you do have an appointment, don't you? bateman steps out of the elevator and walks cautiously down the hallway. owen's door is open. the apartment is freshly painted, and has been immaculately redecorated in english country house style overstuffed sofas, lots of chintz. there are flowers everywhere, and a young yuppie couple stands admiring the place talking to the realtor, mrs. wolfe. bateman wanders down the hallway, looking for familiar signs. he stops at the closet where we last saw two dead girls hanging. he opens the door and the light switches on, but it is empty. mrs. wolfe approaches, smiling. are you my two o'clock? no."
AMERICAN_PSYCHO,INT. PAUL OWEN'S APARTMENT BUILDING - DAY,BATEMAN,can i help you? im looking for... paul owen's... place. she stares at him impassively. doesn't he live here?
AMERICAN_PSYCHO,INT. PAUL OWEN'S APARTMENT BUILDING - DAY,BATEMAN,"no, he doesn't. are you sure? you saw the ad in the times? no. yes. i mean yes, i did. in the times. but... doesn't paul owen still, live here? there was no ad in the times. bateman is shaking as they continue to stare at each other. i think you should go now. but i think... i want to know what happened here. don't make any trouble. please. i suggest you go. bateman backs away slowly. don't come back. i won't... don't worry. mrs. wolfe glares at him as he walks down the hall, rattled, and gets into the elevator."
AMERICAN_PSYCHO,EXT. DEPARTMENT STORE - DAY,GUY,"hey, kinsley."
AMERICAN_PSYCHO,EXT. DEPARTMENT STORE - DAY,GUY,"see you at fluties, okay? the guy walks away, utterly unfazed. bateman wanders down the street, banging his briefcase against walls, garbage cans, etc."
AMERICAN_PSYCHO,EXT. MIDTOWN PHONE BOOTH - DAY,JEAN,"patrick bateman's office. jean?' hello? jean? patrick? is that you? hello? jean, i need help i where are you? jean i'm not jean craig mcdermott called. he wants to meet you and david van patten and tim price at harry's for drinks. oh god, what did you say, you dumb bitch? patrick? i can't hear you. what am i doing? where are you? patrick, what's wrong?"
AMERICAN_PSYCHO,EXT. MIDTOWN PHONE BOOTH - DAY,BATEMAN,"i don't think i'm gonna make it, jean. pause. ...to the office this afternoon. why?"
AMERICAN_PSYCHO,EXT. MIDTOWN PHONE BOOTH - DAY,CUT TO,"just...say...no! whatis it, patrick? are you alright? stop sounding so fucking sad! jesus! he hangs up. he throws the walkman which is around his neck into a nearby trash can, and wipes his face with his jacket."
AMERICAN_PSYCHO,INT. BATEMAN'S OFFICE - SAME DAY,ELIZABETH,those are sarah lawrence guys patrick. you're making me feel weird...
AMERICAN_PSYCHO,INT. HARRY'S BAR - EVENING,BATEMAN,"bateman, you're looking a little wildeyed rough day at the office? they all laugh. hey look price is back. and he's drinking perrier. he's a changed man. except...he still can't get a reservation to save his life. bateman sits down silently. why don't you try 150 wooster? just fucking call them. i'm not going anywhere unless we have a reservation. le cirque, flamingo east, oyster bar, come on, faggots just get a res. keep your shirt on. maybe lose the suspenders. bateman spots harold carnes at the bar, tenses. excuse me, gentleman. right back. he approaches carnes cautiously. face it the japanese will own most of this country by the end of the 90s. bateman approaches, trying to act casual shut up, carnes, they will not. carnes is surprised, turns around, looks vaguely confused."
AMERICAN_PSYCHO,INT. HARRY'S BAR - EVENING,CARNES,"so harold, did you get my message? carnes lights a cigarette, stalling. then laughs. jesus, davis. yes. that was hilarious. that was you, wasn't it? yes, naturally. bateman killing owen and the escort girls? oh that's fabulous. that's rich. pause. it was a pretty long message, wasnt it? what exactly do you mean? the message you left. carnes is distracted, waving at people. by the way, davis, how is cynthia? you're still seeing her, right? but wait, harold, what do you mean? carnes isn't really listening. excuse me. nothing. good to see you. is that edward towers? he turns to go. carnes? wait."
AMERICAN_PSYCHO,INT. HARRY'S BAR - EVENING,BATEMAN,"what are you talking about? bateman is what? oh christ. he can barely pick up an escort girl, let alone ... what was it you said he did to her? carnes looks around the club, raises his glass to a passing couple. he laughs politely. now, if you'll excuse me, i reallymust... wait. stop. you don't seem to understand. you're not really comprehending any of this. i killed him. i did it, carnes. i'm patrick bateman. i chopped owen's fucking head off. i tortured dozens of girls. the whole message i left on your machine was true. excuse me. i really must be going. no! listen, don't you know who i am? i'm not davis, i'm patrick bateman! i talk to you on the phone all the time! don't you recognize me? you're my lawyer. carnes stares at him in confusion and annoyance."
AMERICAN_PSYCHO,INT. HARRY'S BAR - EVENING,PRICE,"but that's simply not possible. and i don't find this funny anymore. it never was supposed to be! why isn't it possible? it's just not. why not, you stupid bastard? carnes stares at him. because i had dinner with paul owen twice in london... just ten days ago. no, you... didn't? now, if you'll excuse me. bateman returns back to his friends' table, in a daze. they are all looking at the television, where ronald reagan is giving a speech about iran contra. they are halfheartedly arguing about whether or not he's lying. how can he lie like that? how can he pull that shit? what shit? now where do we have reservations at? i mean i'm not really hungry, but i would like to have reservations somewhere."
AMERICAN_PSYCHO,INT. HARRY'S BAR - EVENING,PRICE,"he is totally harmless, you geek. was totally harmless. just like you are totally harmless. but he did do all that shit and you have failed to get us into 150, so you know, what can i say? i just don't see how someone, anyone, can appear that way and yet be involved in such total shit. how can you be so fucking, i don't know, cool about it? some guys are just born cool, i guess. bateman laughs at this. price shoots him a look. and bateman, what are you so fucking zany about? i'm just a happy camper. rockin' and a rollin'. rehab's done wonders for you, pal. working for unicef now? do you want another perrier, timothy? some seltzer water? oh brother. look he presents himself as a harmless old codger. but inside... pause. but inside..."
AMERICAN_PSYCHO,INT. HARRY'S BAR - EVENING,PRICE,"but inside doesn't matter... the sounds of the bar return. inside? yes, inside? believe it or not, price, we're actually listening to you. bateman? come on, what do you think? bateman looks up and smiles at price. then shrugs. whatever."
AMERICAN_PSYCHO,INT. HARRY'S BAR - EVENING,BATEMAN V/O,"whose moronic idea was it to drink dry beers? i need a scotch. the sounds of the bar fade down. the following voice over runs over images of bateman and his friends ordering drinks, talking on portable phones, talking, laughing combined with images of other, very similar young men at other tables drinking, talking on portable phones, talking, laughing. there are no more barriers to cross. all i have in common with the uncontrollable and the insane, the vicious and the evil, all the mayhem i have caused and my utter indifference toward it, i have now surpassed..."
AMERICAN_PSYCHO,INT. BATEMAN'S OFFICE - DAY,BATEMAN V/O,my pain is constant and sharp and i do not hope for a better world for anyone. in fact i want my pain to be inflicted on others. i want no one to escape.
AMERICAN_PSYCHO,INT. HARRY'S BAR - EARLY EVENING,CREDITS ROLL,"but even after admitting this, there is no catharsis. i gain no deeper knowledge about myself, no new knowledge can be extracted from my telling. there has been no reason for. me to tell you any of this. this confession has meant nothing... the camera moves up to a sign on the wall behind him 'this is not an exit'."
SW_EpisodeIV,UNKNOWN_SCENE,THREEPIO,did you hear that? they've shut down the main reactor. we'll be destroyed for sure. this is madness!
SW_EpisodeIV,UNKNOWN_SCENE,THREEPIO,we're doomed!
SW_EpisodeIV,UNKNOWN_SCENE,THREEPIO,there'll be no escape for the princess this time.
SW_EpisodeIV,UNKNOWN_SCENE,THREEPIO,what's that?
SW_EpisodeIV,UNKNOWN_SCENE,THREEPIO,i should have known better than to trust the logic of a halfsized thermocapsulary dehousing assister...
SW_EpisodeIV,UNKNOWN_SCENE,LUKE,hurry up! come with me! what are you waiting for?! get in gear!
SW_EpisodeIV,UNKNOWN_SCENE,THREEPIO,"artoo! artoodetoo, where are you?"
SW_EpisodeIV,UNKNOWN_SCENE,THREEPIO,at last! where have you been?
SW_EpisodeIV,UNKNOWN_SCENE,THREEPIO,they're heading in this direction. what are we going to do? we'll be sent to the spice mines of kessel or smashed into who knows what!
SW_EpisodeIV,UNKNOWN_SCENE,THREEPIO,"wait a minute, where are you going?"
SW_EpisodeIV,UNKNOWN_SCENE,IMPERIAL OFFICER,the death star plans are not in the main computer.
SW_EpisodeIV,UNKNOWN_SCENE,VADER,where are those transmissions you intercepted?
SW_EpisodeIV,UNKNOWN_SCENE,REBEL OFFICER,we intercepted no transmissions. aaah... this is a consular ship. were on a diplomatic mission.
SW_EpisodeIV,UNKNOWN_SCENE,VADER,if this is a consular ship... where is the ambassador?
SW_EpisodeIV,UNKNOWN_SCENE,VADER,"commander, tear this ship apart until you've found those plans and bring me the ambassador. i want her alive!"
SW_EpisodeIV,UNKNOWN_SCENE,TROOPER,there she is! set for stun!
SW_EpisodeIV,UNKNOWN_SCENE,TROOPER,she'll be all right. inform lord vader we have a prisoner.
SW_EpisodeIV,UNKNOWN_SCENE,THREEPIO,"hey, you're not permitted in there. it's restricted. you'll be deactivated for sure.."
SW_EpisodeIV,UNKNOWN_SCENE,THREEPIO,"don't call me a mindless philosopher, you overweight glob of grease! now come out before somebody sees you."
SW_EpisodeIV,UNKNOWN_SCENE,THREEPIO,secret mission? what plans? what are you talking about? i'm not getting in there!
SW_EpisodeIV,UNKNOWN_SCENE,THREEPIO,i'm going to regret this.
SW_EpisodeIV,UNKNOWN_SCENE,CHIEF PILOT,there goes another one.
SW_EpisodeIV,UNKNOWN_SCENE,CAPTAIN,hold your fire. there are no life forms. it must have been shortcircuited.
SW_EpisodeIV,UNKNOWN_SCENE,THREEPIO,"that's funny, the damage doesn't look as bad from out here."
SW_EpisodeIV,UNKNOWN_SCENE,THREEPIO,are you sure this things safe?
SW_EpisodeIV,UNKNOWN_SCENE,WOMAN,i've told you kids to slow down!
SW_EpisodeIV,UNKNOWN_SCENE,FIXER,did i hear a young noise blast through here?
SW_EpisodeIV,UNKNOWN_SCENE,CAMIE,it was just wormie on another rampage.
SW_EpisodeIV,UNKNOWN_SCENE,LUKE,shape it up you guys!... biggs?
SW_EpisodeIV,UNKNOWN_SCENE,LUKE,i didn't know you were back! when did you get in?
SW_EpisodeIV,UNKNOWN_SCENE,BIGGS,"just now. i wanted to surprise you, hot shot. i thought you'd be here... certainly didn't expect you to be out working."
SW_EpisodeIV,UNKNOWN_SCENE,LUKE,"the academy didn't change you much... but you're back so soon? hey, what happened, didn't you get your commission?"
SW_EpisodeIV,UNKNOWN_SCENE,BIGGS,of course i got it. signed aboard the rand ecliptic last week. first mate biggs darklighter at your service...... i just came back to say goodbye to all you unfortunate landlocked simpletons.
SW_EpisodeIV,UNKNOWN_SCENE,LUKE,i almost forgot. there's a battle going on! right here in our system. come and look!
SW_EpisodeIV,UNKNOWN_SCENE,DEAK,not again! forget it.
SW_EpisodeIV,UNKNOWN_SCENE,LUKE,there they are!
SW_EpisodeIV,UNKNOWN_SCENE,BIGGS,"that's no battle, hot shot... they're just sitting there! probably a freightertanker refueling."
SW_EpisodeIV,UNKNOWN_SCENE,LUKE,but there was a lot of firing earlier...
SW_EpisodeIV,UNKNOWN_SCENE,LUKE,"hey, easy with those..."
SW_EpisodeIV,UNKNOWN_SCENE,CAMIE,"don't worry about it, wormie."
SW_EpisodeIV,UNKNOWN_SCENE,FIXER,"i keep telling you, the rebellion is a long way from here. i doubt if the empire would even fight to keep this system. believe me luke, this planet is a big hunk of nothing..."
SW_EpisodeIV,UNKNOWN_SCENE,LEIA,"lord vader, i should have known. only you could be so bold. the imperial senate will not sit stillfor this, when they hear you've attacked a diplomatic..."
SW_EpisodeIV,UNKNOWN_SCENE,VADER,"don't play games with me, your highness. you weren't on any mercy mission this time. you passed directly through a restricted system. several transmissions were beamed to this ship by rebel spies. i want to know what happened to the plans they sent you."
SW_EpisodeIV,UNKNOWN_SCENE,LEIA,i don't know what you're talking about. i'm a member of the imperial senate on a diplomatic mission to alderaan...
SW_EpisodeIV,UNKNOWN_SCENE,VADER,you're a part of the rebel alliance... and a traitor. take her away!
SW_EpisodeIV,UNKNOWN_SCENE,COMMANDER,"holding her is dangerous. if word of this gets out, it could generate sympathy for the rebellion in the senate."
SW_EpisodeIV,UNKNOWN_SCENE,VADER,i have traced the rebel spies to her. now she is my only link to find their secret base!
SW_EpisodeIV,UNKNOWN_SCENE,COMMANDER,you anything.
SW_EpisodeIV,UNKNOWN_SCENE,VADER,leave that to me. send a distress signal and then inform the senate that all aboard were killed!
SW_EpisodeIV,UNKNOWN_SCENE,SECOND OFFICER,"lord vader, the battle station plans are not aboard this ship! and no transmissions were made. an escape pod was jettisoned during the fighting, but no life forms were aboard."
SW_EpisodeIV,UNKNOWN_SCENE,VADER,"she must have hidden the plans in the escape pod. send a detachment down to retrieve them. see to it personally, commander. there'll be no one to stop us this time."
SW_EpisodeIV,UNKNOWN_SCENE,COMMANDER,"yes, sir."
SW_EpisodeIV,UNKNOWN_SCENE,THREEPIO,how did i get into this mess? i really don't know how. we seem to be made to suffer. it's our lot in life.
SW_EpisodeIV,UNKNOWN_SCENE,THREEPIO,i've got to rest before i fall apart. my joints are almost frozen.
SW_EpisodeIV,UNKNOWN_SCENE,THREEPIO,what a desolate place this is.
SW_EpisodeIV,UNKNOWN_SCENE,THREEPIO,where are you going?
SW_EpisodeIV,UNKNOWN_SCENE,THREEPIO,"well, i'm not going that way. it's much too rocky. this way is much easier."
SW_EpisodeIV,UNKNOWN_SCENE,THREEPIO,what makes you think there are settlements over there?
SW_EpisodeIV,UNKNOWN_SCENE,THREEPIO,don't get technical with me.
SW_EpisodeIV,UNKNOWN_SCENE,THREEPIO,"what mission? what are you talking about? i've had just about enough of you! go that way! you'll be malfunctioning within a day, you nearsighted scrap pile!"
SW_EpisodeIV,UNKNOWN_SCENE,THREEPIO,"and don't let me catch you following me begging for help, because you won't get it."
SW_EpisodeIV,UNKNOWN_SCENE,THREEPIO,no more adventures. i'm not going that way.
SW_EpisodeIV,UNKNOWN_SCENE,THREEPIO,"that malfunctioning little twerp. this is all his fault! he tricked me into going this way, but he'll do no better."
SW_EpisodeIV,UNKNOWN_SCENE,THREEPIO,"wait, what's that? a transport! i'm saved!"
SW_EpisodeIV,UNKNOWN_SCENE,THREEPIO,"over here! help! please, help!"
SW_EpisodeIV,UNKNOWN_SCENE,LUKE,"... so i cut off my power, shut down the afterburners and came in low on deak's trail. i was so close i thought i was going to fry my instruments. as it was i busted up the skyhopper pretty bad. uncle owen was pretty upset. he grounded me for the rest of the season. you should have been there... it was fantastic."
SW_EpisodeIV,UNKNOWN_SCENE,BIGGS,"you ought to take it a little easy luke. you may be the hottest bushpilot this side of mos eisley, but those little skyhoppers are dangerous. keep it up, and one day, whammo, you're going to be nothing more than a dark spot on the down side of a canyon wall."
SW_EpisodeIV,UNKNOWN_SCENE,LUKE,look who's talking. now that you've been around those giant starships you're beginning to sound like my uncle. you've gotten soft in the city...
SW_EpisodeIV,UNKNOWN_SCENE,BIGGS,i've missed you kid.
SW_EpisodeIV,UNKNOWN_SCENE,LUKE,"well, things haven't been the same since you left, biggs. it's been so...quiet."
SW_EpisodeIV,UNKNOWN_SCENE,BIGGS,"luke, i didn't come back just to say goodbye... i shouldn't tell you this, but you're the only one i can trust... and if i don't come back, i want somebody to know."
SW_EpisodeIV,UNKNOWN_SCENE,LUKE,what are you talking about?
SW_EpisodeIV,UNKNOWN_SCENE,BIGGS,"i made some friends at the academy. ... when our frigate goes to one of the central systems, we're going to jump ship and join the alliance..."
SW_EpisodeIV,UNKNOWN_SCENE,LUKE,join the rebellion?! are you kidding! how?
SW_EpisodeIV,UNKNOWN_SCENE,BIGGS,quiet down will ya! you got a mouth bigger than a meteor crater!
SW_EpisodeIV,UNKNOWN_SCENE,LUKE,i'm sorry. i'm quiet. listen how quiet i am. you can barely hear me...
SW_EpisodeIV,UNKNOWN_SCENE,BIGGS,my friend has a friend on bestine who might help us make contact.
SW_EpisodeIV,UNKNOWN_SCENE,LUKE,around forever trying to find them.
SW_EpisodeIV,UNKNOWN_SCENE,BIGGS,"i know it's a long shot, but if i don't find them i'll do what i can on my own... it's what we always talked about. luke, i'm not going to wait for the empire to draft me into service. the rebellion is spreading and i want to be on the right side the side i believe in."
SW_EpisodeIV,UNKNOWN_SCENE,LUKE,and i'm stuck here...
SW_EpisodeIV,UNKNOWN_SCENE,BIGGS,i thought you were going to the academy next term. you'll get your chance to get off this rock.
