Movie,Scene,Character,Dialogue
AMERICAN_PSYCHO,"INT. CONFERENCE ROOM, PIERCE & PIERCE - DAY",VAN PATTEN,"it is very cool, bateman. but that's nothing. he pulls a card out of his wallet and slaps it on the table. look at this. they all lean forward to inspect it. that's really nice. bateman clenches his fists beneath the table, trying to control his anxiety. eggshell with romalian type. what do you think?"
AMERICAN_PSYCHO,"INT. CONFERENCE ROOM, PIERCE & PIERCE - DAY",PRICE,"jesus. this is really super. how'd a nitwit like you get so tasteful? bateman stares at his own card and then enviously at mcdermott's. i can't believe that price prefers mcdermott's card to mine. but wait. you ain't seen nothin' yet. he holds up his own card. raised lettering, pale nimbus white..."
AMERICAN_PSYCHO,"INT. CONFERENCE ROOM, PIERCE & PIERCE - DAY",LUIS,"impressive. very nice. let's see paul owen's card. price pulls a card from an inside coat pocket and holds it up for their inspection ""paul owen, pierce pierce, mergers and acquisitions"". bateman swallows, speechless. the sound in the room dies down and all we hear is a faint heartbeat as bateman stares at the magnificent card. look at that subtle offwhite coloring. the tasteful thickness of it. oh my god, it even has a watermark... his hand shaking, bateman lifts up the card and stares at it until fills the screen. he lets it fall. the sound returns to normal. is something wrong? patrick...you're sweating."
AMERICAN_PSYCHO,EXT. STREET - EVENING,BATEMAN,"hello. pat bateman. the homeless man stares at bateman, struggling to sit up. you want some money? some... food? the homeless man nods arid starts to cry. bateman reaches into his pocket and pulls out a 10 bill, then changes his mind and holds out a 5 instead."
AMERICAN_PSYCHO,EXT. STREET - EVENING,HOMELESS MAN,"is this what you need? the homeless man nods, looks away, wipes his nose. i'm so hungry. it's cold out, too, isn't it? i'm so hungry. why don't you get a job? if you're so hungry, why don't you get a job? i lost my job... why? were you drinking? is that why you lost it? insider trading? just joking. no, really were you drinking on the job? i was fired. i was laid off. gee, uh, that's too bad. im so hungry. the dog starts to whimper. why don't you get another one? why don't you get another job? i'm not... you're not what? qualified for anything else?"
AMERICAN_PSYCHO,EXT. STREET - EVENING,BATEMAN,"i know that, i know that. jeez, you're like a broken record. i'm trying to help you. i'm hungry. listen, do you think it's fair to take money from people who do have jobs? from people who do work? what am i gonna do? listen, what's your name? al."
AMERICAN_PSYCHO,EXT. STREET - EVENING,BATEMAN,speak up. come on. al.
AMERICAN_PSYCHO,EXT. STREET - EVENING,BATEMAN,"get a goddamn job, al. you've got a negative attitude. that's what's stopping you. you've got to get your act together. i'll help you. you're so kind, mister. you're kind. you're a kind man. i can tell. shhhh... it's okay. please... i don't know what to do. i'm so cold."
AMERICAN_PSYCHO,EXT. STREET - EVENING,BATEMAN,"i can't... i can't find a shelter. you reek. you reek of...shit. do you know that? goddammit, al look atme and stop crying like some kind of faggot. al... i'm sorry. bateman carefully puts the money back in his wallet. its just that... i don't know. i don't have anything in common with you. he opens his brief case and pulls out a long thin knife with a serrated edge. he pushes up the sleeve of his jacket to protect it. do you know what a fucking loser you are? homeless man's pov as bateman lunges at him with the knife. extreme wide shot of the street. bateman's shadowed figure is hunched over the homeless man, stabbing him in the stomach. the dog barks wildly and bateman stomps on it until it is silent. low angle shot of bateman as he throws a quarter on the ground. there's a quarter. go buy some gum. bateman walks calmly into the empty caverns of wall street. cars drift past, their headlights momentarily illuminating the body left twitching on the ground."
AMERICAN_PSYCHO,INT. BEAUTY SALON - DAY,BATEMAN V/O,"what beautiful skin you have, mr. bateman. so fine, so smooth... his eyes open to look up at the facialist and then he closes them again. i have all the characteristics of a human being flesh, blood, skin, hair but not a single clear, identifiable emotion except for greed and disgust. something horrible is happening inside me and i don't know why. bateman sitting in a chair, looking down at the manicurist who is giving him a pedicure. she is cutting his nails with tiny sharp scissors. he stares at them longingly. my nightly bloodlust has overflowed into my days. i feel lethal, on the verge of frenzy. bateman lying irradiated by ultra violet light on a tanning bed, wearing goggles. i think my mask of sanity is about to slip."
AMERICAN_PSYCHO,INT. YALE CLUB - DAY,MCDERMOTT,what an asshole. why is laurie kennedy dating price? he's a fucking drug addict. no self control.
AMERICAN_PSYCHO,INT. YALE CLUB - DAY,ALL IN UNISON,"but laurie kennedy is a total hardbody. what do you think, bateman? i know her. i knew her. why do you say it like that? why does he say it like that? because he dated her. how did you guess? girls dig bateman. he's gq. you're total gq bateman. thanks guy, but...she's got a lousy personality. so what? it's all looks. laurie kennedy is a babe. don't even pretend you were interested for any other reason. if they have a good personality then something is very wrong. if they have a good personality and they are not great looking who fucking cares? well, lets just say hypothetically, okay? what if they have a good personality? i know, i know there are no girls with good personalities!"
AMERICAN_PSYCHO,INT. YALE CLUB - DAY,MCDERMOTT,"a good personality consists of a chick with a little hardbody who will satisfy all sexual demands without being too slutty about things and who will essentially keep her dumb fucking mouth shut. listen, the only girls with good personalities who are smart or maybe funny or halfway intelligent or even talented though god knows what the fuck that meansare ugly chicks. absolutely. and this is because they have to make up for how fucking unattractive they are. pause. do you know what ed gein said about women? ed gein? maitre d at canal bar? no, serial killer, wisconsin in the fifties. he was an interesting guy. so what did ed say? he said, ""when i see a pretty girl walking down the street i think two things. one part of me wants to take her out and talk to her and be real nice and sweet and treat her right."" pauses, finishes his drink. what does the other part of him think?"
AMERICAN_PSYCHO,INT. YALE CLUB - DAY,BATEMAN,"what her head would look like on a stick. mcdermott and van patten look at each other and then back at bateman. bateman starts to laugh, and the other two uneasily join in. luis carruthers walks up to the table. hi guys. i wanna get your opinion on something. mcdermott rolls his eyes at the rest of the table. if it's about the bowtie you're wearing, you know how' we feel about it. luis laughs good naturedly. yes, i do. no, it's my business card i decided to get a new one too. he pulls out something incredibly tasteful. everyone compliments luis except bateman. the sound drops and all we hear is the beating of his heart as he stares at the card enviously. luis plucks it from his hand and walks away, pleased with himself. listen, what about dinner? is that all you ever have to contribute, van patten? 'what about fucking dinner'? ah, cheer up, bateman. what's the matter? no shiatsu this morning?"
AMERICAN_PSYCHO,INT. YALE CLUB - DAY,VAN PATTEN,"whoa, hold on there little buddy. excuse me. he gets up from the table. as bateman walks away, van patten grabs a waiter. is this tap water? i don't drink tap water. bring me an evian or something, okay?"
AMERICAN_PSYCHO,INT. MEN'S ROOM - DAY,CARRUTHERS,god patrick. why here ? he strokes bateman's hair. i've seen you looking at me. i've noticed your hot body.
AMERICAN_PSYCHO,INT. MEN'S ROOM - DAY,BATEMAN,"don't be shy. bateman takes a deep breath, closes his eyes and tries to lift his hands again, but abandons the attempt. you don't know how long i've wanted it. ever since that christmas party at arizona 206. you know the one, you were wearing that red striped paisley armani tie. bateman looks down and sees'that carruthers' pants are still unzipped. he moves past him out of the stall and stands by the sink and pretends to wash his hand until he realizes he still has his gloves on. carruthers comes up behind him. i want you. i want you .. too. bateman storms out of the men's room, bumping intoa waiter and several customers and cursing. noticing the maitre d' and another waiter conferring and looking at him strangely bateman straightens up and smiles and waves cheerfully at them. carruthers walks up behind him. what...is...it? where are you going? i've gotta...i've gotta...return some video tapes. patrick? what?"
AMERICAN_PSYCHO,INT. BATEMAN'S APARTMENT - AFTERNOON,BATEMAN,"bateman is sitting in his arm chair, phone book in handy jerking off. he is squealing into the phone and breathing. you like that, slut? the person on the other end clearly hangs up. close on his fingers dialing the phone. you want to know what i'm wearing? sixty dollar boxer shorts by ralph lauren, a hundred and fifty dollar white cotton tshirt by commes des garcons. my rolex cost another hang up. he dials again. i'm a corporate raider. i orchestrate hostile takeovers. what'do you think of that?"
AMERICAN_PSYCHO,INT. BATEMAN'S APARTMENT - AFTERNOON,GIRL,"dad, is that you? bateman hangs up, frustrated."
AMERICAN_PSYCHO,EXT. STREET/INT. LIMOUSINE - NIGHT,BATEMAN,"i haven't seen you around here. you just haven't been looking. would you like to see my apartment? bateman flips on the light inside the limo. he's wearing a tuxedo. i'm not supposed to. bateman is holding out a hundred dollar bill, which christie now notices, then takes. do you want to come to my apartment or not? i'm not supposed to. but i can make an exception. do you take american express? christie is still looking out behind her. do you take american express?"
AMERICAN_PSYCHO,EXT. STREET/INT. LIMOUSINE - NIGHT,BATEMAN,"i'm joking. come on, get in. as they drive uptown, bateman dials the cell phone. he reads off a credit card number. i'd like a girl, early twenties, blonde, who does couples. couples. 55 west eighty first, the american gardens building. apartment 7c. and i really can't stress blonde enough. blonde. he hangs up. i'm paul. my name is paul owen, have you got that? you are christie. you are to respond only to christie. is that clear?"
AMERICAN_PSYCHO,INT. BATEMAN'S APARTMENT - NIGHTI,BATEMAN,"that's a very fine chardonnay you're drinking. long pause, in which christie is luxuriating in the tub and bateman is casually touching her breast. i want you to clean your vagina. christie reaches for a washcloth. no. from behind. get on your knees. christie shrugs. i want to watch. you have a very nice body. the doorman rings. bateman answers."
AMERICAN_PSYCHO,INT. BATEMAN'S APARTMENT - NIGHTI,BATEMAN,"thank you. send her up. christie, get out and dry off, choose a robe not the bijan, and come and meet me and our guest in the living room for drinks. bateman answers the door. you've arrived! how lovely. let me take your coat. i'm paul. how good of you to come. the escort girl looks somewhat bewildered. bateman takes her coat and inspects her body and face. not quite blonde, are you? more dirty blonde. i'm going to call you sabrina. i'm paul owen. bateman escorts her into the living room and brings her a glass of wine. christie enters, sitting next to sabrina on the couch, and bateman sits across from them. there is a long silence. so, don't you want to know what i do? the two girls look at each other with uncomfortable smiles. christie shrugs. no."
AMERICAN_PSYCHO,INT. BATEMAN'S APARTMENT - NIGHTI,BATEMAN,"no, not really. bateman is visibly irritated, recrosses his legs. well, i work on wall street. at pierce pierce. have you heard of it?"
AMERICAN_PSYCHO,INT. BATEMAN'S APARTMENT - NIGHTI,BATEMAN,"you have a really nice place here paul. how much did you pay for it? actually, that's none of your business, christie, but i can assure you it certainly wasn't cheap. bateman leaves to refill his wine glass and sabrina takes a pack of cigarettes out of her purse. bateman returns, carrying a tray of chocolates. no, no smoking. not in here. he walks over to christie. varda truffle? christie stares at the plate and shakes her head. sabrina takes one. i dont want you to get drunk, but that's a very fine chardonnay you're not drinking. bateman goes over to his cds and scans his vast collection. he takes one out and examines it. do you like phil collins? i've been a big genesis fan ever since the release of their 1980 album, duke. before that i really didn't understand any of their work. it was too artsy, too intellectual. it was on duke where phil collins' presence became more apparent. he puts aside the cd and takes out another one. i think 'invisible touch' is the group's undisputed masterpiece."
AMERICAN_PSYCHO,INT. BATEMAN'S APARTMENT - NIGHTI,BATEMAN,"it's an epic meditation on intangibility, at the same time it deepens and enriches the.meaning of the preceding three albums. christie, take off the robe. bateman puts out a lace teddy. he motions to christie to put it on. listen to the brilliant ensemble playing of banks, collins and rutherford. you can practically hear every nuance of every instrument. sabrina, remove your dress. bateman starts to undress. in terms of lyrical craftsmanship and sheer song writing, this album hits a new peak of professionalism. sabrina, why don't you dance a little? sabrina dances awkwardly. christie sits on the bed. take the lyrics to 'land of confusion'. in this song, phil collins addresses the problem of abusive political authority. bateman knots a silk scarf around christie's neck rather menacingly then helps her into some suede gloves. 'in too deep' is the most moving pop song of the 1980s about monogamy and commitment. the song is extremely uplifting. their lyrics are as positive and affirmative as anything i've heard in rock. he turns on the video camera."
AMERICAN_PSYCHO,INT. BATEMAN'S APARTMENT - NIGHTI,CUT TO,"phil collins' solo efforts seem to be more commercial and therefore more satisfying in a narrower way, especially songs like 'in the air tonight' and 'against all odds'. sabrina, don't just stare at it. eat it. he walks over to the sound system in his bedroom and slides in the cd. but i also think that phil collins works better within the confines of the group than as a solo artist and i stress the word artist. this is 'sussudio', a great, great song, a personal favorite. sex montage cut to 'sussudio'. we see this in wide shot, or through the lens of the video camera. bateman asleep in his bed with christie and sabrina on either side of him. sabrina accidentally touches his wrist. bateman's eyes open. don't touch the rolex. bateman gets up from his bed and goes over to his armoire. he opens the drawer in which are a nail gun, a coat hanger, a rusty butter knife, and a halfsmoked cigar. he turns around to see christie and sabrina both starting to get up and get dressed. he takes the coat hanger. we're not through yet...."
AMERICAN_PSYCHO,INT. EVELYN'S CHRISTMAS PARTY - EVENING,EVELYN,"hey, mccloy, what do you say? hey, hamilton, have a holly jolly christmas. across the room courtney is greeting paul owen with a kiss. bateman glares at them. is owen still handling the fisher account? mistletoe alert! merry xmas, patrick! merry xmas, harry! evelyn rushes up. to them with mistletoe in her hand, raising it above their heads. she is wearing a sable jacket and green velvet pants by ralph lauren, and has a small vietnamese potbellied pig in her arms. the pig is wearing a santa hat. she tries to make bateman kiss the pig. bateman has a glass in one hand and a dish of waldorf salad in the other, and is unable to defend himself from evelyn."
AMERICAN_PSYCHO,INT. EVELYN'S CHRISTMAS PARTY - EVENING,HAMILTON,"merry... christmas. you're late, honey. i'm not late. oh yes you are. i've been here the entire time. you just didn't see me. where did you get that awful scratch? i... uh.. got my hand caught in the vcr. say hello to snowball. snowball says ""merry christmas, patrick"". what...is...it? it's a little baby piggy wiggy, isn't it? it's a vietnamese potbellied pig. they make darling pets. don't you? don't you?' bateman is horrified. oh, stop scowling. you're such a grinch. did you know he's the grinch?"
AMERICAN_PSYCHO,INT. EVELYN'S CHRISTMAS PARTY - EVENING,RHINEBECK,"and what does mr. grinch want for christmas? and don't tell me breast implants again. a passing stranger comes up behind bateman and puts paper antlers on his head, without him noticing. bateman walks away, and is bumped into by humphrey hey, bateman! when wearing a tuxedo, how do you keep the front of your shirt from riding up? you simply have a tab with a buttonhole sewn into the front of your shirt, which can then be attached by a button to your trousers. and hamilton? take those fucking antlers off your head you look like a retard. excuse me. bateman walks toward paul owen. rhinebeck feels the top of his head. oh my god. owen!"
AMERICAN_PSYCHO,INT. EVELYN'S CHRISTMAS PARTY - EVENING,OWEN,"marcus! merry christmas! how've you been? workaholic, i suppose. haven't seen you in a while. well, just got back from the knickerbocker club."
AMERICAN_PSYCHO,INT. EVELYN'S CHRISTMAS PARTY - EVENING,OWEN,we should have dinner. maybe you could bring... cecelia?
AMERICAN_PSYCHO,INT. EVELYN'S CHRISTMAS PARTY - EVENING,EVELYN,"yes, cecelia. oh, cecelia would... adore it. well, let's do it, marcus. patrick? why is he calling you marcus bateman mistletoe alert! he grabs evelyn and kisses her on the mouth, stifling her words. owen and his. friends wander off. evelyn melts. oh patrick, you're so sweet."
AMERICAN_PSYCHO,INT. TEXARKANA RESTAURANT - NIGHT,MAITRE D,marcus halberstam. for two at eight?
AMERICAN_PSYCHO,INT. TEXARKANA RESTAURANT - NIGHT,OWEN,"no, i want to know. i came here for the cilantro crawfish gumbo, which is after all the only excuse one could have for being in this restaurant, which is by the way, almost complete empty. am i to believe that all ten people in this restaurant have eaten your entire supply of cilantro crawfish gumbo? i'm very sorry, sir. there was a fire in the kitchen earlier today, andbateman jb, straight. and a dixie beer. would you like to hearowen double absolut martini. yes sir. would you like to hear the specials? not if you want to keep your spleen. the waiter leaves. this is a real beehive of, uh, activity, halberstam. this place is hot, very hot. listen the mud soup and the charcoal arugula are outrageous here. yeah', well, you're late."
AMERICAN_PSYCHO,INT. TEXARKANA RESTAURANT - NIGHT,OWEN,"hey, i'm a child of divorce. give me a break. hmmm, i see they've omitted the pork loin with lime jello. we shouldve gone to dorsia. i couldve gotten us a table. nobody goes there anymore. there is a long disgruntled silence. is that ivana trump over there? jeez, patrick, i mean marcus, what are you thinking? why would ivana be at texarkana? another pause. so, wasn't rothschild originally handling the fisher account? how did you get it? i could tell you that, halberstam, but then id have to kill you. he guffaws. bateman laughs politely. paul owen is very drunk. bateman cold sober. i like to dissect girls. did you know i'm utterly insane? owen continues laughing and motions to the waiter for another drink. great tan, marcus. really impressive. where do you tan?"
AMERICAN_PSYCHO,INT. TEXARKANA RESTAURANT - NIGHT,BATEMAN,"i've got a tanning bed at home. you should look into it. bateman nods, agitated. and cecelia, how is she? where is she tonight? cecelia is, well... you know cecelia. i think shes having dinner with... evelyn williams. evelyn. great ass. goes out with that loser patrick bateman. what a dork. another martini, paul? owen nods drunkenly. the end of the meal. owen is squeezing a lime onto the table, missing his beer, incredibly drunk. the check is laid down. paul, give me your amex card. good boy bateman slaps the card down, looks at the check. two hundred and fifty. very reasonable. let's leave a big tip,shall we? my place for a night cap? no, man. i'm gonna bail. come on, you dumb son of a bitch."
AMERICAN_PSYCHO,INT. BATEMAN'S APT - NIGHT,OWEN,"you like huey lewis and the news? they're okay. their early work was a little too new wave for my taste. but when sports came out in 1983, i think they really came into their own, commercially and artistically. bateman walks to his bathroom, taking a large ax out of the shower. he takes two valium. the whole album has a clear, crisp sound and a new sheen of consummate professionalism that gives the songs a big boost. bateman comes back out and leans the ax against the wall. he walks to the foyer and puts on a raincoat, watching owen from behind all the time. he's been compared to elvis costello but i think huey has a more bitter, cynical sense of humor. owen is absentmindedly leafing through the barney's catalogue."
AMERICAN_PSYCHO,INT. BATEMAN'S APT - NIGHT,OWEN,"yes, owen? why are their copies of the style section all over the place? do you have a dog? a chow or something? no, owen."
AMERICAN_PSYCHO,INT. BATEMAN'S APT - NIGHT,BATEMAN,"is that a raincoat? yes it is. bateman moves to the cd player. he takes a cd out of its case and slides it in the machine. in 1987 huey released this, four, their most accomplished album. i think their undisputed masterpiece is 'hip to be square', a song so catchy that most people probably don't listen to the lyrics. but they should because it's not just about the pleasures of conformity and the importance of trends. it's also a personal statement about the band itself. bateman puts on 'hip to be square'. bateman crosses the room and picks up the ax. we follow bateman from behind as he walks up to owen, the ax raised over his head. hey paul?"
AMERICAN_PSYCHO,INT. BATEMAN'S APT - NIGHT,BATEMAN,"try getting a reservation at dorsia now you fucking stupid bastard! low angle on bateman as he beats owen with the back of the ax. off screen, the sound of the ax hitting owen. fucking bastard... bateman takes his raincoat off, still panting. he folds the coat carefully in half, bloody side in, and drapes it neatly over the back of a chair. he sits back on the white sofa and surveys the scene. he checks his rolex and lights a cigar. offscreen paul owen's last faint sighs are heard."
AMERICAN_PSYCHO,EXT. STREET - NIGHT,CARRUTHERS,patrick? is that you? no luis. it's not me. you're mistaken.
AMERICAN_PSYCHO,EXT. STREET - NIGHT,BATEMAN,"commes des garcon. a cab stops. bateman opens the door and manages to get owen' s body into the backseat. bateman gets in the cab. call me please, patrick. satan lives, luis."
AMERICAN_PSYCHO,INT. PAUL OWEN'S APARTMENT - NIGHT,BATEMAN,"where to send the bastard? dallas? paris? he throws some clothes into a suitcase, randomly grabbing toiletries and shoving them in. singapore? london. i'll send the asshole to london."
AMERICAN_PSYCHO,INT. PAUL OWEN'S APARTMENT - NIGHT,BATEMAN,"hi, this is paul. i've been called away to london for a few days. meredith, i'll call you when i get back. hasta la vista, baby."
AMERICAN_PSYCHO,INT. BATEMAN'S OFFICE - MORNING,BATEMAN,what is it? patrick?
AMERICAN_PSYCHO,INT. BATEMAN'S OFFICE - MORNING,JEAN,"yees jean? patrick, a mr. donald kimball is here to see you. who?"
AMERICAN_PSYCHO,INT. BATEMAN'S OFFICE - MORNING,JEAN,"detective donald kimball?. silence. bateman stares out the window, then down at the drawing of a headless woman he's been doodling on the back cover of sports illustrated. tell him i'm at lunch. patrick, i think he knows you're here. it's only tenthirty. silence."
AMERICAN_PSYCHO,INT. BATEMAN'S OFFICE - MORNING,KIMBALL,"send him in, i guess. as she exits, he picks up the cordless phone and pretends to talk to someone at the other end. now john, you've got towear clothes in proportion to your physique. there are definite do's and don'ts, good buddy, of wearing a boldstriped shirt. a bold striped shirt calls for solid colored or discreetly patterned suits and ties... the door to the office opens and he waves in detective donald kimball. kimball is surprisingly young about bateman's age and good looking, dressed in a crumpled linen armani suit of the type bateman and his friends might wear. kimball sits down and crosses his legs with a selfassurance that makes bateman so nervous he forgets to carry on with his fake conversation. kimball looks up at him curiously, noticing the silence. right. and yes...always tip the stylist fifteen percent. bateman shrugs at the detective, rolling his eyes in exasperation. kimball nods understandingly. listen john, i've got to go. t. boone pickens just walked in... just joking... no don't tip the owner of the salon. okay john, right, got it. sorry about that. no, i'm sorry. i should've made an appointment."
