Movie,Scene,Character,Dialogue
SW_EpisodeIV,UNKNOWN_SCENE,HAN,what's your plan?
SW_EpisodeIV,UNKNOWN_SCENE,LUKE,"uh... threepio, hand me those binders there will you?"
SW_EpisodeIV,UNKNOWN_SCENE,LUKE,"okay. now, i'm going to put these on you."
SW_EpisodeIV,UNKNOWN_SCENE,LUKE,"okay. han, you put these on."
SW_EpisodeIV,UNKNOWN_SCENE,HAN,"don't worry, chewie. i think i know what he has in mind."
SW_EpisodeIV,UNKNOWN_SCENE,THREEPIO,"master luke, sir! pardon me for asking... but, ah... what should artoo and i do if we're discovered here?"
SW_EpisodeIV,UNKNOWN_SCENE,LUKE,lock the door!
SW_EpisodeIV,UNKNOWN_SCENE,HAN,and hope they don't have blasters.
SW_EpisodeIV,UNKNOWN_SCENE,THREEPIO,that isn't very reassuring.
SW_EpisodeIV,UNKNOWN_SCENE,LUKE,i can't see a thing in this helmet.
SW_EpisodeIV,UNKNOWN_SCENE,HAN,this is not going to work.
SW_EpisodeIV,UNKNOWN_SCENE,LUKE,why didn't you say so before?
SW_EpisodeIV,UNKNOWN_SCENE,HAN,i did say so before!
SW_EpisodeIV,UNKNOWN_SCENE,OFFICER,where are you taking this... thing?
SW_EpisodeIV,UNKNOWN_SCENE,LUKE,prisoner transfer from block oneonethreeeight.
SW_EpisodeIV,UNKNOWN_SCENE,OFFICER,i wasn't notified. i'll have to clear it.
SW_EpisodeIV,UNKNOWN_SCENE,HAN,look out! he's loose!
SW_EpisodeIV,UNKNOWN_SCENE,LUKE,he's going to pull us all apart.
SW_EpisodeIV,UNKNOWN_SCENE,HAN,go get him!
SW_EpisodeIV,UNKNOWN_SCENE,HAN,we've got to find out which cell this princess of yours is in. here it is... cell twentyoneeightseven. you go get her. i'll hold them here.
SW_EpisodeIV,UNKNOWN_SCENE,HAN,everything is under control. situation normal.
SW_EpisodeIV,UNKNOWN_SCENE,INTERCOM VOICE,what happened?
SW_EpisodeIV,UNKNOWN_SCENE,HAN,"uh... had a slight weapons malfunction. but, uh, everything's perfectly all right now. we're fine. we're all fine here, now, thank you. how are you?"
SW_EpisodeIV,UNKNOWN_SCENE,INTERCOM VOICE,we're sending a squad up.
SW_EpisodeIV,UNKNOWN_SCENE,HAN,"uh, uh, negative, negative. we had a reactor leak here now. give us a few minutes to lock it down. large leak... very dangerous."
SW_EpisodeIV,UNKNOWN_SCENE,INTERCOM VOICE,who is this? what's your operating number?
SW_EpisodeIV,UNKNOWN_SCENE,HAN,boring conversation anyway.luke! we're going to have company!
SW_EpisodeIV,UNKNOWN_SCENE,LEIA,aren't you a little short for a stormtrooper?
SW_EpisodeIV,UNKNOWN_SCENE,LUKE,what? oh... the uniform. i'm luke skywalker. i'm here to rescue you.
SW_EpisodeIV,UNKNOWN_SCENE,LEIA,you're who?
SW_EpisodeIV,UNKNOWN_SCENE,LUKE,i'm here to rescue you. i've got your r2 unit. i'm here with ben kenobi.
SW_EpisodeIV,UNKNOWN_SCENE,LEIA,ben kenobi is here! where is he?
SW_EpisodeIV,UNKNOWN_SCENE,LUKE,come on!
SW_EpisodeIV,UNKNOWN_SCENE,VADER,he is here...
SW_EpisodeIV,UNKNOWN_SCENE,TARKIN,obiwan kenobi! what makes you think so?
SW_EpisodeIV,UNKNOWN_SCENE,VADER,a tremor in the force. the last time i felt it was in the presence of my old master.
SW_EpisodeIV,UNKNOWN_SCENE,TARKIN,surely he must be dead by now.
SW_EpisodeIV,UNKNOWN_SCENE,VADER,don't underestimate the force.
SW_EpisodeIV,UNKNOWN_SCENE,TARKIN,"the jedi are extinct, their fire has gone out of the universe. you, my friend, are all that's left of their religion."
SW_EpisodeIV,UNKNOWN_SCENE,TARKIN,yes.
SW_EpisodeIV,UNKNOWN_SCENE,INTERCOM VOICE,"governor tarkin, we have an emergency alert in detention block aatwentythree."
SW_EpisodeIV,UNKNOWN_SCENE,TARKIN,the princess! put all sections on alert!
SW_EpisodeIV,UNKNOWN_SCENE,VADER,obiwan is here. the force is with him.
SW_EpisodeIV,UNKNOWN_SCENE,TARKIN,"if you're right, he must not be allowed to escape."
SW_EpisodeIV,UNKNOWN_SCENE,VADER,escape may not his plan. i must face him alone.
SW_EpisodeIV,UNKNOWN_SCENE,HAN,chewie!
SW_EpisodeIV,UNKNOWN_SCENE,HAN,get behind me! get behind me!
SW_EpisodeIV,UNKNOWN_SCENE,HAN,can't get out that way.
SW_EpisodeIV,UNKNOWN_SCENE,LEIA,looks like you managed to cut off our only escape route.
SW_EpisodeIV,UNKNOWN_SCENE,HAN,"maybe you'd like it back in your cell, your highness."
SW_EpisodeIV,UNKNOWN_SCENE,LUKE,seethreepio! seethreepio!
SW_EpisodeIV,UNKNOWN_SCENE,THREEPIO,yes sir?
SW_EpisodeIV,UNKNOWN_SCENE,LUKE,we've been cut off! are there any other ways out of the cell bay?...what was that? i didn't copy!
SW_EpisodeIV,UNKNOWN_SCENE,THREEPIO,"i said, all systems have been alerted to your presence, sir. the main entrance seems to be the only way out all other information on your level is restricted."
SW_EpisodeIV,UNKNOWN_SCENE,TROOPER VOICE,open up in there!
SW_EpisodeIV,UNKNOWN_SCENE,THREEPIO,"oh, no!"
SW_EpisodeIV,UNKNOWN_SCENE,LUKE,there isn't any other way out.
SW_EpisodeIV,UNKNOWN_SCENE,HAN,i can't hold them off forever! now what?
SW_EpisodeIV,UNKNOWN_SCENE,LEIA,"this is some rescue. when you came in here, didn't you have a plan for getting out?"
SW_EpisodeIV,UNKNOWN_SCENE,HAN,"he's the brains, sweetheart."
SW_EpisodeIV,UNKNOWN_SCENE,LUKE,"well, i didn't..."
SW_EpisodeIV,UNKNOWN_SCENE,HAN,what the hell are you doing?
SW_EpisodeIV,UNKNOWN_SCENE,LEIA,"somebody has to save our skins. into the garbage chute, wise guy."
SW_EpisodeIV,UNKNOWN_SCENE,HAN,get in there you big furry oaf! i don't care what you smell! get in there and don't worry about it.
SW_EpisodeIV,UNKNOWN_SCENE,HAN,wonderful girl! either i'm going to kill her or i'm beginning to like her. get in there!
SW_EpisodeIV,UNKNOWN_SCENE,HAN,oh! the garbage chute was a really wonderful idea. what an incredible smell you've discovered! let's get out of here! get away from there...
SW_EpisodeIV,UNKNOWN_SCENE,LUKE,no! wait!
SW_EpisodeIV,UNKNOWN_SCENE,LUKE,will you forget it? i already tried it. it's magnetically sealed!
SW_EpisodeIV,UNKNOWN_SCENE,LEIA,put that thing away! you're going to get us all killed.
SW_EpisodeIV,UNKNOWN_SCENE,HAN,"absolutely, your worship. look, i had everything under control until you led us down here. you know, it's not going to take them long to figure out what happened to us."
SW_EpisodeIV,UNKNOWN_SCENE,LEIA,it could be worse...
SW_EpisodeIV,UNKNOWN_SCENE,HAN,it's worse.
SW_EpisodeIV,UNKNOWN_SCENE,LUKE,there's something alive in here!
SW_EpisodeIV,UNKNOWN_SCENE,HAN,that's your imagination.
SW_EpisodeIV,UNKNOWN_SCENE,LUKE,something just moves past my leg! look! did you see that?
SW_EpisodeIV,UNKNOWN_SCENE,HAN,what?
SW_EpisodeIV,UNKNOWN_SCENE,LUKE,help!
SW_EpisodeIV,UNKNOWN_SCENE,HAN,luke! luke! luke!
SW_EpisodeIV,UNKNOWN_SCENE,LEIA,luke!
SW_EpisodeIV,UNKNOWN_SCENE,LEIA,"luke, luke, grab a hold of this."
SW_EpisodeIV,UNKNOWN_SCENE,LUKE,"blast it, will you! my gun's jammed."
SW_EpisodeIV,UNKNOWN_SCENE,HAN,where?
SW_EpisodeIV,UNKNOWN_SCENE,LUKE,anywhere! oh!!
SW_EpisodeIV,UNKNOWN_SCENE,HAN,luke! luke!
SW_EpisodeIV,UNKNOWN_SCENE,LEIA,grab him!
SW_EpisodeIV,UNKNOWN_SCENE,LEIA,what happened?
SW_EpisodeIV,UNKNOWN_SCENE,LUKE,"i don't know, it just let go of me and disappeared..."
SW_EpisodeIV,UNKNOWN_SCENE,HAN,i've got a very bad feeling about this.
SW_EpisodeIV,UNKNOWN_SCENE,LUKE,the walls are moving!
SW_EpisodeIV,UNKNOWN_SCENE,LEIA,don't just stand there. try and brace it with something.
SW_EpisodeIV,UNKNOWN_SCENE,LUKE,wait a minute!
SW_EpisodeIV,UNKNOWN_SCENE,LUKE,threepio! come in threepio! threepio! where could he be?
SW_EpisodeIV,UNKNOWN_SCENE,FIRST TROOPER,take over!see to him! look there!
SW_EpisodeIV,UNKNOWN_SCENE,THREEPIO,"they're madmen! they're heading for the prison level. if you hurry, you might catch them."
SW_EpisodeIV,UNKNOWN_SCENE,FIRST OFFICER,follow me! you stand guard.
SW_EpisodeIV,UNKNOWN_SCENE,THREEPIO,come on!
SW_EpisodeIV,UNKNOWN_SCENE,THREEPIO,"oh! all this excitement has overrun the circuits of my counterpart here. if you don't mind, i'd like to take him down to maintenance."
SW_EpisodeIV,UNKNOWN_SCENE,TROOPER,all right.
SW_EpisodeIV,UNKNOWN_SCENE,LUKE,"threepio! come in, threepio! threepio!"
SW_EpisodeIV,UNKNOWN_SCENE,HAN,get to the top!
SW_EpisodeIV,UNKNOWN_SCENE,LEIA,i can't
SW_EpisodeIV,UNKNOWN_SCENE,LUKE,"where could he be? threepio! threepio, will you come in?"
SW_EpisodeIV,UNKNOWN_SCENE,THREEPIO,they aren't here! something must have happened to them. see if they've been captured.
SW_EpisodeIV,UNKNOWN_SCENE,THREEPIO,hurry!
SW_EpisodeIV,UNKNOWN_SCENE,HAN,one thing's for sure. we're all going to be a lot thinner!get on top of it!
SW_EpisodeIV,UNKNOWN_SCENE,LEIA,i'm trying!
SW_EpisodeIV,UNKNOWN_SCENE,THREEPIO,"thank goodness, they haven't found them! where could they be?"
SW_EpisodeIV,UNKNOWN_SCENE,THREEPIO,"use the comlink? oh, my! i forgot i turned it off!"
SW_EpisodeIV,UNKNOWN_SCENE,THREEPIO,"are you there, sir?"
SW_EpisodeIV,UNKNOWN_SCENE,LUKE,threepio!
SW_EpisodeIV,UNKNOWN_SCENE,THREEPIO,we've had some problems...
SW_EpisodeIV,UNKNOWN_SCENE,LUKE,"shut down all the garbage mashers on the detention level, will you? do you copy?"
SW_EpisodeIV,UNKNOWN_SCENE,LUKE,shut down all the garbage mashers on the detention level.
SW_EpisodeIV,UNKNOWN_SCENE,LUKE,shut down all the garbage mashers on the detention level.
SW_EpisodeIV,UNKNOWN_SCENE,THREEPIO,no. shut them all down! hurry!
SW_EpisodeIV,UNKNOWN_SCENE,THREEPIO,"listen to them! they're dying, artoo! curse my metal body! i wasn't fast enough. it's all my fault! my poor master!"
SW_EpisodeIV,UNKNOWN_SCENE,LUKE,"threepio, we're all right!"
SW_EpisodeIV,UNKNOWN_SCENE,LUKE,we're all right. you did great.
SW_EpisodeIV,UNKNOWN_SCENE,LUKE,"hey... hey, open the pressure maintenance hatch on unit number... where are we?"
SW_EpisodeIV,UNKNOWN_SCENE,HAN,threetwosixeighttwoseven.
SW_EpisodeIV,UNKNOWN_SCENE,HAN,"if we can just avoid any more female advice, we ought to be able to get out of here."
SW_EpisodeIV,UNKNOWN_SCENE,LUKE,"well, let's get moving!"
SW_EpisodeIV,UNKNOWN_SCENE,HAN,where are you going?
SW_EpisodeIV,UNKNOWN_SCENE,LEIA,"no, wait. they'll hear!"
SW_EpisodeIV,UNKNOWN_SCENE,HAN,"come here, you big coward!"
SW_EpisodeIV,UNKNOWN_SCENE,HAN,chewie! come here!
SW_EpisodeIV,UNKNOWN_SCENE,LEIA,"listen. i don't know who you are, or where you came from, but from now on, you do as i tell you. okay?"
SW_EpisodeIV,UNKNOWN_SCENE,HAN,"look, your worshipfulness, let's get one thing straight! i takeorders from one person! me!"
SW_EpisodeIV,UNKNOWN_SCENE,LEIA,it's a wonder you're still alive.will somebody get this big walking carpet out of my way?
SW_EpisodeIV,UNKNOWN_SCENE,HAN,no reward is worth this.
SW_EpisodeIV,UNKNOWN_SCENE,OFFICER,secure this area until the alert is canceled.
SW_EpisodeIV,UNKNOWN_SCENE,FIRST TROOPER,give me regular reports.
SW_EpisodeIV,UNKNOWN_SCENE,FIRST TROOPER,do you know what's going on?
SW_EpisodeIV,UNKNOWN_SCENE,SECOND TROOPER,maybe it's another drill.
SW_EpisodeIV,UNKNOWN_SCENE,SECOND TROOPER,what was that?
SW_EpisodeIV,UNKNOWN_SCENE,FIRST TROOPER,"oh, it's nothing. don't worry about it."
SW_EpisodeIV,UNKNOWN_SCENE,HAN,there she is.
SW_EpisodeIV,UNKNOWN_SCENE,LUKE,"seethreepio, do you copy?"
SW_EpisodeIV,UNKNOWN_SCENE,THREEPIO,"for the moment. uh, we're in the main hangar across from the ship."
SW_EpisodeIV,UNKNOWN_SCENE,LUKE,we're right above you. stand by.
SW_EpisodeIV,UNKNOWN_SCENE,LEIA,you came in that thing? you're braver that i thought.
SW_EpisodeIV,UNKNOWN_SCENE,HAN,nice! come on!
SW_EpisodeIV,UNKNOWN_SCENE,FIRST TROOPER,it's them! blast them!
SW_EpisodeIV,UNKNOWN_SCENE,HAN,get back to the ship!
SW_EpisodeIV,UNKNOWN_SCENE,LUKE,where are you going? come back!
SW_EpisodeIV,UNKNOWN_SCENE,LEIA,he certainly has courage.
SW_EpisodeIV,UNKNOWN_SCENE,LUKE,what good will it do us if he gets himself killed? come on!
SW_EpisodeIV,UNKNOWN_SCENE,LUKE,i think we took a wrong turn.
SW_EpisodeIV,UNKNOWN_SCENE,LEIA,there's no lock!
SW_EpisodeIV,UNKNOWN_SCENE,LUKE,that oughta hold it for a while.
SW_EpisodeIV,UNKNOWN_SCENE,LEIA,"quick, we've got to get across. find the control that extends the bridge."
SW_EpisodeIV,UNKNOWN_SCENE,LUKE,"oh, i think i just blasted it."
SW_EpisodeIV,UNKNOWN_SCENE,LEIA,they're coming through!
SW_EpisodeIV,UNKNOWN_SCENE,LUKE,"here, hold this."
SW_EpisodeIV,UNKNOWN_SCENE,LEIA,here they come!
SW_EpisodeIV,UNKNOWN_SCENE,LEIA,for luck!
SW_EpisodeIV,UNKNOWN_SCENE,THREEPIO,where could they be?
SW_EpisodeIV,UNKNOWN_SCENE,TROOPER,close the blast doors!
SW_EpisodeIV,UNKNOWN_SCENE,TROOPER,open the blast doors! open the blast doors!
SW_EpisodeIV,UNKNOWN_SCENE,VADER,"i've been waiting for you, obiwan. we meet again, at last. the circle is now complete."
SW_EpisodeIV,UNKNOWN_SCENE,VADER,"when i left you, i was but the learner now i am the master."
SW_EpisodeIV,UNKNOWN_SCENE,BEN,"only a master of evil, darth."
SW_EpisodeIV,UNKNOWN_SCENE,VADER,"your powers are weak, old man."
SW_EpisodeIV,UNKNOWN_SCENE,BEN,"you can't win, darth. if you strike me down, i shall become more powerful than you can possibly imagine."
SW_EpisodeIV,UNKNOWN_SCENE,HAN,didn't we just leave this party?
SW_EpisodeIV,UNKNOWN_SCENE,HAN,what kept you?
SW_EpisodeIV,UNKNOWN_SCENE,LEIA,we ran into some old friends.
SW_EpisodeIV,UNKNOWN_SCENE,LUKE,is the ship all right?
SW_EpisodeIV,UNKNOWN_SCENE,HAN,"seems okay, if we can get to it.just hope the old man got the tractor beam out of commission."
SW_EpisodeIV,UNKNOWN_SCENE,LUKE,look!
SW_EpisodeIV,UNKNOWN_SCENE,THREEPIO,"come on, artoo, we're going!"
SW_EpisodeIV,UNKNOWN_SCENE,HAN,now's our chance! go!
SW_EpisodeIV,UNKNOWN_SCENE,LUKE,no!
SW_EpisodeIV,UNKNOWN_SCENE,HAN,come on!
SW_EpisodeIV,UNKNOWN_SCENE,LEIA,"come on! luke, its too late!"
SW_EpisodeIV,UNKNOWN_SCENE,HAN,blast the door! kid!
SW_EpisodeIV,UNKNOWN_SCENE,BEN,"run, luke! run!"
SW_EpisodeIV,UNKNOWN_SCENE,HAN,"i hope the old man got that tractor beam out if commission, or this is going to be a real short trip. okay, hit it!"
SW_EpisodeIV,UNKNOWN_SCENE,HAN,we're coming up on the sentry ships. hold 'em off! angle the deflector shields while i charge up the main guns!
SW_EpisodeIV,UNKNOWN_SCENE,LUKE,i can't believe he's gone.
SW_EpisodeIV,UNKNOWN_SCENE,LEIA,there wasn't anything you could have done.
SW_EpisodeIV,UNKNOWN_SCENE,HAN,"come on, buddy, we're not out of this yet!"
SW_EpisodeIV,UNKNOWN_SCENE,HAN,"you in, kid? okay, stay sharp!"
SW_EpisodeIV,UNKNOWN_SCENE,LEIA,here they come!
SW_EpisodeIV,UNKNOWN_SCENE,LUKE,they're coming in too fast!
SW_EpisodeIV,UNKNOWN_SCENE,THREEPIO,oooh!
SW_EpisodeIV,UNKNOWN_SCENE,LEIA,we've lost lateral controls.
SW_EpisodeIV,UNKNOWN_SCENE,HAN,"don't worry, she'll hold together."
SW_EpisodeIV,UNKNOWN_SCENE,HAN,"you hear me, baby? hold together!"
SW_EpisodeIV,UNKNOWN_SCENE,LUKE,got him! i got him!
SW_EpisodeIV,UNKNOWN_SCENE,HAN,great kid! don't get cocky.
SW_EpisodeIV,UNKNOWN_SCENE,LEIA,there are still two more of them out there!
SW_EpisodeIV,UNKNOWN_SCENE,LUKE,that's it! we did it!
SW_EpisodeIV,UNKNOWN_SCENE,LEIA,we did it!
SW_EpisodeIV,UNKNOWN_SCENE,THREEPIO,help! i think i'm melting!this is all your fault.
SW_EpisodeIV,UNKNOWN_SCENE,TARKIN,are they away?
SW_EpisodeIV,UNKNOWN_SCENE,VADER,they have just made the jump into hyperspace.
SW_EpisodeIV,UNKNOWN_SCENE,TARKIN,"you're sure the homing beacon is secure aboard their ship? i'm taking an awful risk, vader. this had better work."
SW_EpisodeIV,UNKNOWN_SCENE,HAN,"not a bad bit of rescuing, huh? you know, sometimes i even amaze myself."
SW_EpisodeIV,UNKNOWN_SCENE,LEIA,"that doesn't sound too hard. besides, they let us go. it's the only explanation for the ease of our escape."
SW_EpisodeIV,UNKNOWN_SCENE,HAN,easy... you call that easy?
SW_EpisodeIV,UNKNOWN_SCENE,LEIA,their tracking us!
SW_EpisodeIV,UNKNOWN_SCENE,HAN,"not this ship, sister."
SW_EpisodeIV,UNKNOWN_SCENE,LEIA,at least the information in artoo is still intact.
SW_EpisodeIV,UNKNOWN_SCENE,HAN,what's so important? what's he carrying?
SW_EpisodeIV,UNKNOWN_SCENE,LEIA,"the technical readouts of that battle station. i only hope that when the data is analyzed, a weakness can be found. it's not over yet!"
SW_EpisodeIV,UNKNOWN_SCENE,HAN,"it is for me, sister! look, i ain't in this for your revolution, and i'm not in it for you, princess. i expect to be well paid. i'm in it for the money!"
SW_EpisodeIV,UNKNOWN_SCENE,LEIA,"you needn't worry about your reward. if money is all that you love, then that's what you'll receive!"
SW_EpisodeIV,UNKNOWN_SCENE,LEIA,your friend is quite a mercenary. i wonder if he really cares about anything... or anyone.
SW_EpisodeIV,UNKNOWN_SCENE,LUKE,i care!
SW_EpisodeIV,UNKNOWN_SCENE,LUKE,"so... what do you think of her, han?"
SW_EpisodeIV,UNKNOWN_SCENE,HAN,"i'm trying not to, kid!"
SW_EpisodeIV,UNKNOWN_SCENE,LUKE,good...
SW_EpisodeIV,UNKNOWN_SCENE,HAN,"still, she's got a lot of spirit. i don't know, what do you think? do you think a princess and a guy like me..."
SW_EpisodeIV,UNKNOWN_SCENE,LUKE,no!
SW_EpisodeIV,UNKNOWN_SCENE,WILLARD,you're safe! we had feared the worst.
SW_EpisodeIV,UNKNOWN_SCENE,WILLARD,"when we heard about alderaan, we were afraid that you were... lost along with your father."
SW_EpisodeIV,UNKNOWN_SCENE,LEIA,"we don't have time for our sorrows, commander. the battle station has surely tracked us here.it's the only explanation for the ease of our escape. you must use the information in this r2 unit to plan the attack. it is our only hope."
SW_EpisodeIV,UNKNOWN_SCENE,TARKIN,yes.
SW_EpisodeIV,UNKNOWN_SCENE,DEATH STAR INTERCOM VOICE,we are approaching the planet yavin. the rebel base is on a moon on the far side. we are preparing to orbit the planet.
SW_EpisodeIV,UNKNOWN_SCENE,DODONNA,the battle station is heavily shielded and carries a firepower greater than half the star fleet.its defenses are designed around a direct largescale assault. a small oneman fighter should be able to penetrate the outer defense.
SW_EpisodeIV,UNKNOWN_SCENE,GOLD LEADER,"pardon me for asking, sir, but what good are snub fighters going to be against that?"
SW_EpisodeIV,UNKNOWN_SCENE,DODONNA,"well, the empire doesn't consider a small oneman fighter to be any threat, or they'd have a tighter defense. an analysis of the plans provided by princess leia has demonstrated a weakness in the battle station."
SW_EpisodeIV,UNKNOWN_SCENE,DODONNA,"the approach will not be easy. you are required to maneuver straight down this trench and skim the surface to this point. the target area is only two meters wide. it's a small thermal exhaust port, right below the main port. the shaft leads directly to the reactor system. a precise hit will start a chain reaction which should destroy the station."
SW_EpisodeIV,UNKNOWN_SCENE,DODONNA,"only a precise hit will set up a chain reaction. the shaft is rayshielded, so you'll have to use proton torpedoes."
SW_EpisodeIV,UNKNOWN_SCENE,WEDGE,"that's impossible, even for a computer."
SW_EpisodeIV,UNKNOWN_SCENE,LUKE,it's not impossible. i used to bullseye womp rats in my tsixteen back home. they're not much bigger than two meters.
SW_EpisodeIV,UNKNOWN_SCENE,DODONNA,man your ships! and may the force be with you!
SW_EpisodeIV,UNKNOWN_SCENE,DEATH STAR INTERCOM VOICE,orbiting the planet at maximum velocity. the moon with the rebel base will be in range in thirty minutes.
SW_EpisodeIV,UNKNOWN_SCENE,VADER,this will be a day long remembered. it has seen the end of kenobi and it will soon see the end of the rebellion.
SW_EpisodeIV,UNKNOWN_SCENE,MAN,"all flight troops, man your stations. all flight troops, man your stations."
SW_EpisodeIV,UNKNOWN_SCENE,LUKE,so... you got your reward and you're just leaving then?
SW_EpisodeIV,UNKNOWN_SCENE,HAN,"that's right, yeah! i got some old debts i've got to pay off with this stuff. even if i didn't, you don't think i'd be fool enough to stick around here, do you? why don't you come with us? you're pretty good in a fight. i could use you."
SW_EpisodeIV,UNKNOWN_SCENE,LUKE,"come on! why don't you take a look around? you know what's about to happen, what they're up against. they could use a good pilot like you. you're turning your back on them."
SW_EpisodeIV,UNKNOWN_SCENE,HAN,"what good's a reward if you ain't around to use it? besides, attacking that battle station ain'tmy idea of courage. it's more like suicide."
SW_EpisodeIV,UNKNOWN_SCENE,LUKE,"all right. well, take care of yourself, han... guess that's what you're best at, isn't it?"
SW_EpisodeIV,UNKNOWN_SCENE,HAN,"hey, luke... may the force be with you!"
SW_EpisodeIV,UNKNOWN_SCENE,HAN,what're you lookin' at? i know what i'm doing.
SW_EpisodeIV,UNKNOWN_SCENE,LEIA,what's wrong?
SW_EpisodeIV,UNKNOWN_SCENE,LUKE,"oh, it's han! i don't know, i really thought he'd change his mind."
SW_EpisodeIV,UNKNOWN_SCENE,LEIA,he's got to follow his own path. no one can choose it for him.
SW_EpisodeIV,UNKNOWN_SCENE,LUKE,i only wish ben were here.
SW_EpisodeIV,UNKNOWN_SCENE,BIGGS,luke! i don't believe it! how'd you get here... are you going out with us?!
SW_EpisodeIV,UNKNOWN_SCENE,LUKE,"biggs! of course, i'll be up there with you! listen, have i got some stories to tell..."
SW_EpisodeIV,UNKNOWN_SCENE,RED LEADER,are you... luke skywalker? have you been checked out on the incom tsixtyfive?
SW_EpisodeIV,UNKNOWN_SCENE,BIGGS,"sir, luke is the best bushpilot in the outer rim territories."
SW_EpisodeIV,UNKNOWN_SCENE,RED LEADER,"i met your father once when i was just a boy. he was a great pilot. you'll do all right. if you've got half of your father's skill, you'll do better than all right."
SW_EpisodeIV,UNKNOWN_SCENE,LUKE,"thank you, sir. i'll try."
SW_EpisodeIV,UNKNOWN_SCENE,BIGGS,"i've got to get aboard. listen, you'll tell me your stories when we come back. all right?"
SW_EpisodeIV,UNKNOWN_SCENE,LUKE,"i told you i'd make it someday, biggs."
SW_EpisodeIV,UNKNOWN_SCENE,BIGGS,"you did, all right. it's going to be like old times luke. we're a couple of shooting stars that'll never be stopped!"
SW_EpisodeIV,UNKNOWN_SCENE,CHIEF,this r2 unit of your seems a bit beat up. do you want a new one?
SW_EpisodeIV,UNKNOWN_SCENE,LUKE,"not on your life! that little droid and i have been through a lot together.you okay, artoo?"
SW_EpisodeIV,UNKNOWN_SCENE,CHIEF,"okay, easy she goes!"
SW_EpisodeIV,UNKNOWN_SCENE,THREEPIO,"hang on tight, artoo, you've got to come back."
SW_EpisodeIV,UNKNOWN_SCENE,THREEPIO,"you wouldn't want my life to get boring, would you?"
SW_EpisodeIV,UNKNOWN_SCENE,BEN,"luke, the force will be with you."
SW_EpisodeIV,UNKNOWN_SCENE,MASSASSI INTERCOM VOICE,"standby alert. death star approaching. estimated time to firing range, fifteen minutes."
SW_EpisodeIV,UNKNOWN_SCENE,RED LEADER,all wings report in.
SW_EpisodeIV,UNKNOWN_SCENE,RED TEN,red ten standing by.
SW_EpisodeIV,UNKNOWN_SCENE,RED SEVEN,red seven standing by.
SW_EpisodeIV,UNKNOWN_SCENE,BIGGS,red three standing by.
SW_EpisodeIV,UNKNOWN_SCENE,PORKINS,red six standing by.
SW_EpisodeIV,UNKNOWN_SCENE,RED NINE,red nine standing by.
SW_EpisodeIV,UNKNOWN_SCENE,WEDGE,red two standing by.
SW_EpisodeIV,UNKNOWN_SCENE,RED ELEVEN,red eleven standing by.
SW_EpisodeIV,UNKNOWN_SCENE,LUKE,red five standing by.
SW_EpisodeIV,UNKNOWN_SCENE,RED LEADER,lock sfoils in attack position.
SW_EpisodeIV,UNKNOWN_SCENE,RED LEADER,we're passing through their magnetic field.
SW_EpisodeIV,UNKNOWN_SCENE,RED LEADER,hold tight!
SW_EpisodeIV,UNKNOWN_SCENE,RED LEADER,switch your deflectors on.
SW_EpisodeIV,UNKNOWN_SCENE,RED LEADER,double front!
SW_EpisodeIV,UNKNOWN_SCENE,WEDGE,look at the size of that thing!
SW_EpisodeIV,UNKNOWN_SCENE,RED LEADER,"cut the chatter, red two."
SW_EpisodeIV,UNKNOWN_SCENE,RED LEADER,"accelerate to attack speed. this is it, boys!"
SW_EpisodeIV,UNKNOWN_SCENE,GOLD LEADER,"red leader, this is gold leader."
SW_EpisodeIV,UNKNOWN_SCENE,RED LEADER,"i copy, gold leader."
SW_EpisodeIV,UNKNOWN_SCENE,GOLD LEADER,we're starting for the target shaft now.
SW_EpisodeIV,UNKNOWN_SCENE,RED LEADER,we're in position. i'm going to cut across the axis and try and draw their fire.
SW_EpisodeIV,UNKNOWN_SCENE,WEDGE,"heavy fire, boss! twentythreedegrees."
SW_EpisodeIV,UNKNOWN_SCENE,RED LEADER,i see it. stay low.
SW_EpisodeIV,UNKNOWN_SCENE,LUKE,this is red five! i'm going in!
SW_EpisodeIV,UNKNOWN_SCENE,BIGGS,"luke, pull up!"
SW_EpisodeIV,UNKNOWN_SCENE,BIGGS,are you all right?
SW_EpisodeIV,UNKNOWN_SCENE,LUKE,"i got a little cooked, but i'm okay."
SW_EpisodeIV,UNKNOWN_SCENE,ASTRO-OFFICER,"we count thirty rebel ships, lord vader. but they're so small they're evading our turbolasers!"
SW_EpisodeIV,UNKNOWN_SCENE,VADER,we'll have to destroy them ship to ship. get the crews to their fighters.
SW_EpisodeIV,UNKNOWN_SCENE,RED LEADER,"luke, let me know when you're going in."
SW_EpisodeIV,UNKNOWN_SCENE,LUKE,i'm on my way in now...
SW_EpisodeIV,UNKNOWN_SCENE,RED LEADER,watch yourself! there's a lot of fire coming from the right side of that deflection tower.
SW_EpisodeIV,UNKNOWN_SCENE,LUKE,i'm on it.
SW_EpisodeIV,UNKNOWN_SCENE,CONTROL OFFICER,"squad leaders, we've picked up a new group of signals. enemy fighters coming your way."
SW_EpisodeIV,UNKNOWN_SCENE,LUKE,my scope's negative. i don't see anything.
SW_EpisodeIV,UNKNOWN_SCENE,RED LEADER,"keep up your visual scanning. with all this jamming, they'll be on top of you before your scope can pick them up."
SW_EpisodeIV,UNKNOWN_SCENE,RED LEADER,biggs! you've picked one up... watch it!
SW_EpisodeIV,UNKNOWN_SCENE,BIGGS,i can't see it! where is he?!
SW_EpisodeIV,UNKNOWN_SCENE,BIGGS,"he's on me tight, i can't shake him... i can't shake him."
SW_EpisodeIV,UNKNOWN_SCENE,LUKE,"hang on, biggs, i'm coming in."
SW_EpisodeIV,UNKNOWN_SCENE,LUKE,got him!
SW_EpisodeIV,UNKNOWN_SCENE,VADER,several fighters have broken off from the main group. come with me!
SW_EpisodeIV,UNKNOWN_SCENE,BIGGS,pull in! luke... pull in!
SW_EpisodeIV,UNKNOWN_SCENE,WEDGE,"watch your back, luke!"
SW_EpisodeIV,UNKNOWN_SCENE,WEDGE,"watch your back! fighter's above you, coming in!"
SW_EpisodeIV,UNKNOWN_SCENE,LUKE,"i'm hit, but not bad."
SW_EpisodeIV,UNKNOWN_SCENE,LUKE,"artoo, see what you can do with it. hang on back there."
SW_EpisodeIV,UNKNOWN_SCENE,RED LEADER,red six...
SW_EpisodeIV,UNKNOWN_SCENE,RED LEADER,can you see red five?
SW_EpisodeIV,UNKNOWN_SCENE,RED TEN,"there's a heavy fire zone on this side. red five, where are you?"
SW_EpisodeIV,UNKNOWN_SCENE,LUKE,i can't shake him!
SW_EpisodeIV,UNKNOWN_SCENE,WEDGE,"i'm on him, luke!"
SW_EpisodeIV,UNKNOWN_SCENE,WEDGE,hold on!
